id,username,acctdesc,userlocation,following,followers,totaltweets,usercreatedts,tweetcreatedts,retweetcount,text,hashtags,lat,lon,placeName
1271322832752918534,1960michele,"Consulente  Senior di Direzione
Consulente del Lavoro in Roma e Milano 
Collaboratore di https://t.co/FIH3qxhgBe e
https://t.co/eqyObjxujV","Roma, Lazio",1246,547,3126,2014-10-03 17:57:38,2020-06-12 06:05:58,0,"https://t.co/kmotyrvemP 
Crollo per pandemia e per norme irragionevoli",[],,,
1271322826205609986,valtellinese75,vivi e lascia vivere,,19,48,4848,2015-08-18 09:06:39,2020-06-12 06:05:56,124,"È DALL’INIZIO DELLA PRIMA ONDATA DI COVID CHE CI DITE CHE CI SARÀ UNA SECONDA ONDATA IN AUTUNNO. LO ABBIAMO CAPITO, MA ALMENO ADESSO POSSIAMO VIVERE UN ATTIMO DI SERENITÀ QUESTA ESTATE SENZA RIPETERCELO OGNI GIORNO?",[],,,
1271322681682493440,assodigitale,Assodigitale è la testata editoriale per eccellenza che dal 2004 racconta le tendenze della tecnologia digitale alfabetizzando i lettori italiani e svizzeri CH,lugano - Canton Ticino - CH,160,1850,68405,2009-11-23 14:59:38,2020-06-12 06:05:22,0,Come sterilizzare il proprio Smartphone dal Coronavirus covid-19 facilmente https://t.co/ELGvm4WSNB #breaking #news #update,"[{'text': 'breaking', 'indices': [100, 109]}, {'text': 'news', 'indices': [110, 115]}, {'text': 'update', 'indices': [116, 123]}]",,,
1271322625432682504,MiAirports,Benvenuto nell'account ufficiale degli aeroporti di Milano Linate e Milano Malpensa. Customer Care via Twitter attivo 8-22. Usa #AskLinate #AskMalpensa per info,,1506,32252,34898,2012-04-18 08:49:51,2020-06-12 06:05:08,0,#COVID-19: aggiornamenti sui collegamenti da e per l'aeroporto https://t.co/KolXXrbL9J,"[{'text': 'COVID', 'indices': [0, 6]}]",,,
1271322608810684421,Gondor18140506,So di non sapere. Ma so di sapere molto di più di chi sa di sapere.,,52,141,11122,2019-01-10 20:23:26,2020-06-12 06:05:04,55,"Si, faremo i Pronto Soccorso dedicati al Covid 19. Chi arriva per un infarto dovrà andare in quelli sovraffollati a causa dei vostri tagli. Ma perché non mettiamo anche le giostrine per i bambini con distributori di popcorn? Visto che lavori così bene con la fantasia?
#Mes https://t.co/B6DNACqt5X",[],,,
1271322603051905029,PpPagliaro,,,251,161,31900,2011-10-30 18:59:40,2020-06-12 06:05:03,0,C’è qualcosa ancora che non va per il verso giusto: ma la @RegLombardia attua tracciamento e isolamento dei contagi?Non ci raccontano niente di serio sul #COVID__19. https://t.co/JJBQtEy7EB,"[{'text': 'COVID__19', 'indices': [154, 164]}]",,,
1271322574794878977,srojocarmin,"Nogalense con ascendencia Mayo, tohono o'odham y alemana// cancer free 16•07•19 🦋🎗// LNCI 🌎//malafeminista♀💜",,200,148,12186,2018-04-26 04:16:36,2020-06-12 06:04:56,2,Te odio covid el ornitorrinco 😾,[],,,
1271322553127075844,Huston32848064,abbiamo un problema ... produttore di pallette di cotone da ombelico e volatore pindarico,,155,65,3513,2019-03-29 21:17:28,2020-06-12 06:04:51,258,"Dopodiché dite voi se è normale che questi dati non vengano normalmente comunicati, e se ancora oggi i sindaci lombardi siano del tutto all’oscuro sul numero dei positivi #Covid dei loro comuni.",[],,,
1271322500161388545,vassallogerardo,Docente di lettere. 🇪🇺📗🇮🇹 Sono il migliore.,Campania,2787,2108,2778,2017-12-11 15:27:49,2020-06-12 06:04:38,0,Si prevede una seconda ondata di Covid.,[],,,
1271322478149660672,quotidianodirg,l'informazione che cercavi,Ragusa,2423,2828,41108,2013-03-02 21:28:59,2020-06-12 06:04:33,0,"Ragusa, le fotografie di Eidos per la raccolta fondi contro Covid 19: Ragusa – Uno scatto fotografico contro l’emergenza CoVid-19. In vendita cento fotografie firmate dall’artista Eidos il cui ricavato andrà a sostegno delle famiglie… https://t.co/8DX7A5GMVB via @quotidianodirg https://t.co/hLHjfkbXOh",[],36.9304356,14.74927296,"Ragusa, Sicily"
1271322402115346432,stregaselvaggia,Streghetta selvaggia🕸💛❤. ️Studiosa di Scienze e Tecnologie. Identitaria. Conservatrice nata. Il mio detto: meglio soli che male accompagnati. ➡️🙋,"Benevento, Campania",723,562,10018,2010-01-25 22:31:16,2020-06-12 06:04:15,0,Se arrivano a Gauss e' 30 e lode. Infatti li' son arrivati con il covid 😂😂,[],,,
1271322345337061382,bblltprf,𝐒𝐔𝐆𝐀  ⛩  𝙖𝙜𝙪𝙨𝙩 𝘿   ❏  민윤기,moon line  🌑,317,3828,89600,2010-06-03 21:51:09,2020-06-12 06:04:01,0,@imbiancx a comer maruchan con maruchan ahrejskdjksjs covid de mierda 😭😭😭,[],,,
1271322313024102400,albiuno,"Alieno con sembianze umane, in questo mondo",,1559,1519,77193,2012-01-01 09:21:17,2020-06-12 06:03:54,435,"Il Covid è un ""falso allarme globale"". Lo dicono i medici tedeschi in un rapporto riservato preparato per il governo Merkel. I media italiani hanno nascosto queste informazioni. Non c'è un virus letale. C'è una dittatura che ha preso in ostaggio l'Italia. 
https://t.co/OXwSRassiy",[],,,
1271322309307928576,marzia38580873,"2020 l’anno delle coincidenze, ma io non credo alle coincidenze.  Chi vivrà vedrà...🙏",,196,224,4607,2020-04-19 07:44:43,2020-06-12 06:03:53,435,"Il Covid è un ""falso allarme globale"". Lo dicono i medici tedeschi in un rapporto riservato preparato per il governo Merkel. I media italiani hanno nascosto queste informazioni. Non c'è un virus letale. C'è una dittatura che ha preso in ostaggio l'Italia. 
https://t.co/OXwSRassiy",[],,,
1271322297870110721,AngeloParatico,Proprietario della Gingko Edizioni di Verona. Libri controcorrente.,"Verona, Veneto",909,787,8324,2012-03-13 06:37:09,2020-06-12 06:03:50,0,@singer_frapp @tiecolino @saratripodi2 Evitare il covid non ci renderà immortali.,[],,,"Verona, Veneto"
1271322229251248128,MilanoSpia,Blog di informazione indipendente su Milano,,577,1309,22674,2011-08-11 09:38:46,2020-06-12 06:03:34,0,"Case, il mercato stravolto dal Covid: gli affari in calo e i prezzi in stand by https://t.co/OmlhbA6Fv7 https://t.co/d0C9Ue3oIZ",[],,,
1271322217700179974,RobertoRenga,Turista.,Roma,487,31325,344539,2011-08-11 16:56:40,2020-06-12 06:03:31,2,"poi penso ai negazionisti del covid che ci accusano di aver fatto morire apposta per fare numeri anziani intubati male e che ci siamo inventati tutto in accordo con poteri occulti e mi viene, per la prima volta nella mia vita, da tirare un bestemmione.",[],,,
1271322153816690689,lacittanews,News,"Viterbo, Lazio",29,38,5369,2019-02-11 18:27:47,2020-06-12 06:03:16,0,"l gigante spagnolo dell'abbigliamento Inditex, proprietario di Zara, ora punta un'accelerazione sulle vendite online.  #covid #venditeonline #zara https://t.co/gamnSCJM6s https://t.co/CyVSB4ifVb","[{'text': 'covid', 'indices': [119, 125]}, {'text': 'venditeonline', 'indices': [126, 140]}, {'text': 'zara', 'indices': [141, 146]}]",,,
1271322138847268867,FiomRsu,la dignità dei lavoratori,,269,13,79,2020-05-01 17:00:08,2020-06-12 06:03:12,1,"🔴 Il #Pil crolla, la Cassa integrazione esplode e ""si rischiano 100mila posti di #lavoro persi"", per questo ""serve un nuovo modello di #sviluppo""
🎥 Il servizio #ToscanaLavoro sullo studio #Ires sugli effetti del #Covid sull'economia toscana
👉 VIDEO https://t.co/ypJWOqEGtL https://t.co/p5bS6CqCIv","[{'text': 'Pil', 'indices': [22, 26]}, {'text': 'lavoro', 'indices': [98, 105]}]",,,
1271322118270054402,OA_Sport,"OA Sport, il Tempio degli sport olimpici. Analisi, approfondimenti, interviste e news su tutte le discipline a 360°. Tutti gli sport hanno la stessa dignità.",,2629,12276,141976,2011-11-28 19:52:22,2020-06-12 06:03:07,0,Cosa succede se un giocatore è positivo al Covid-19 e quanti tamponi a settimana fanno le squadre di Serie A? Il protocollo sanitario https://t.co/LIvcMwthpK,[],,,
1271322111336869888,LifeJoining,,,372,272,33117,2019-01-30 12:59:23,2020-06-12 06:03:06,63,"""Con le autopsie che il ministero non voleva fare abbiamo scoperto come uccide il coronavirus"" 
Ribadisco che il rischio trombosi si poteva vedere anche da alcuni esami del sangue. Con il paziente  in vita. Qualche medico può scrivere in merito? #covid_19 https://t.co/W3pW9FfGlM",[],,,
1271322094689636357,TW_SilverSurfer,,,362,98,7545,2013-01-09 07:28:35,2020-06-12 06:03:02,13,"Il Covid ha mostrato i lati negativi della #globalizzazione: ha messo in ginocchio Europa e Usa perché da anni, per le delocalizzazioni, dipendono dalle forniture cinesi, bloccate per il virus.
Inchiesta #Dataroom @Corriere di @M_gabanelli e Luigi Offeddu
https://t.co/OyS7ljcOZk","[{'text': 'globalizzazione', 'indices': [64, 80]}]",,,
1271322048153845762,periodicodaily,La tua informazione quotidiana 🗞📲,,696,478,37276,2012-07-04 13:05:21,2020-06-12 06:02:50,0,Nuova previsione del ragazzo indiano che predisse il Covid-19 https://t.co/mwdQ52HwT2,[],,,
1271321996152803330,ProfidiAndrea,"📍 #Bologna, 12/05/1992 📰 Odg #Umbria - PUBBLICISTA 🆘 @SOSFanta 👨🏻‍💻 Lezione-online 🎓 #UniPg 🔜 #Calciomercato 📸 https://t.co/L8yZhtfO2G…",Italia,210,601,33280,2015-01-15 23:24:00,2020-06-12 06:02:38,0,"#CoppaItalia Dopo 95 giorni torna il #calcio 🔙

FINALMENTE
#JuveMilan 
Una classica del nostro pallone apre la stagione post #Covid!

Il #Belgio 🇧🇪 della Coppa
#Mertens contro #Lukaku, duello tra amici al San Paolo

Tra Balo e #Brescia
rissa continua

#12giugno 
#Gazzetta 🗞 https://t.co/H5BhWJbNmI","[{'text': 'CoppaItalia', 'indices': [0, 12]}, {'text': 'calcio', 'indices': [37, 44]}, {'text': 'JuveMilan', 'indices': [59, 69]}, {'text': 'Covid', 'indices': [125, 131]}, {'text': 'Belgio', 'indices': [137, 144]}, {'text': 'Mertens', 'indices': [160, 168]}, {'text': 'Lukaku', 'indices': [176, 183]}, {'text': 'Brescia', 'indices': [227, 235]}, {'text': '12giugno', 'indices': [252, 261]}, {'text': 'Gazzetta', 'indices': [263, 272]}]",,,
1271321994961670144,giuslom,"Messinese, milanista. Giornalista. Scrivo per ingannare il tempo. Leggo per essere libero. 
In libreria con la bio di George Weah ➡️ https://t.co/gb7GQayACx","Messina, Sicilia",711,678,9758,2008-08-01 17:50:42,2020-06-12 06:02:38,1613,"Leggo che in #Lombardia ieri ci sono stati 32 decessi per #Covid. Non si sa però dove, in quale provincia, perché la Regione non comunica + i dati divisi.
Da quando abbiamo segnalato che i decessi reali erano molti di + di quelli “ufficiali”, hanno secretato i dati per provincia.","[{'text': 'Lombardia', 'indices': [31, 41]}, {'text': 'Covid', 'indices': [76, 82]}]",,,
1271321957628170241,Graziel65255465,Stato Civile: NON SI PUO' SCONFIGGERE CHI NON HA NESSUNA INTENZIONE DI ARRENDERSI,"Emilia Romagna, Italia",1732,1643,46194,2017-07-06 14:11:19,2020-06-12 06:02:29,435,"Il Covid è un ""falso allarme globale"". Lo dicono i medici tedeschi in un rapporto riservato preparato per il governo Merkel. I media italiani hanno nascosto queste informazioni. Non c'è un virus letale. C'è una dittatura che ha preso in ostaggio l'Italia. 
https://t.co/OXwSRassiy",[],,,
1271321933007601665,lagracchiatrice,Laziness wins,,495,328,19889,2014-12-15 17:36:29,2020-06-12 06:02:23,0,Il covid cova sotto le ceneri della Lombardia e attende tempi migliori in autunno.,[],,,
1271321868826361858,infoiteconomia,Sezione economia di informazione.it. Tutte le notizie di economia e finanza provenienti dall'italia e dal mondo.,Italia,0,993,1138989,2011-06-15 09:39:28,2020-06-12 06:02:08,0,Nuova ondata di Covid negli Usa? Le borse tirano il freno a mano https://t.co/HSL0Nd2C2h,[],,,
1271321828376498178,immergasitalia,"Azienda produttrice, leader italiana nel riscaldamento domestico, offre soluzioni integrate ad alta efficienza energetica.",Brescello RE Italia,26,1147,37587,2012-08-22 13:23:14,2020-06-12 06:01:58,0,"DECRETO DEL PRESIDENTE DEL CONSIGLIO DEI MINISTRI  11 giugno 2020 Ulteriori disposizioni attuative del decreto-legge 25 marzo 2020, n. 19 e del decreto-legge 16 maggio 2020, n. 33, misure emergenza epidemiologica #COVID-19. (GU n.147 11-06-20) https://t.co/mAcIkqPjb6","[{'text': 'COVID', 'indices': [213, 219]}]",,,
1271321825981521920,Alessan34721254,"amo il bel calcio, adoro la Juve, la buona cucina e in generale le cose fatte bene..",Milano,120,24,530,2012-10-26 16:07:31,2020-06-12 06:01:57,1613,"Leggo che in #Lombardia ieri ci sono stati 32 decessi per #Covid. Non si sa però dove, in quale provincia, perché la Regione non comunica + i dati divisi.
Da quando abbiamo segnalato che i decessi reali erano molti di + di quelli “ufficiali”, hanno secretato i dati per provincia.","[{'text': 'Lombardia', 'indices': [31, 41]}, {'text': 'Covid', 'indices': [76, 82]}]",,,
1271321810634551298,ErmannoBonapace,"da piccolo  mamma a colazione mi imboccava dicendomi ""AAM pappa buona"".Oggi AAM vuol dire ""Preparati all'Ascolto,preparati all'Amore,preparati alla Meraviglia""",,865,472,18686,2015-11-11 18:31:24,2020-06-12 06:01:54,2,"poi penso ai negazionisti del covid che ci accusano di aver fatto morire apposta per fare numeri anziani intubati male e che ci siamo inventati tutto in accordo con poteri occulti e mi viene, per la prima volta nella mia vita, da tirare un bestemmione.",[],,,
1271321807585284096,ANTEO17,,,3100,1252,146802,2014-03-31 14:04:34,2020-06-12 06:01:53,5,"“La Lega affonda la commissione di inchiesta sull’emergenza Covid-19 in Piemonte. Non vuole che venga approfondita la gestione della sanità in una delle regioni più colpite dal coronavirus. In Consiglio regionale era atteso il voto definitivo, ma il Carroccio si è tirato indietro https://t.co/G3cROUM95r",[],,,
1271321807392395265,Cristin82074935,,,339,210,8207,2018-11-16 08:12:05,2020-06-12 06:01:53,2,Un romanzo scritto prima che arrivasse il Covid 19 ma che racconta una pandemiacome quella che stiamo vivendo https://t.co/QCM4xgzmeB @sulromanzo @edizpiemme https://t.co/u1gaDnrZfL,[],,,
1271321785477115910,aurora_pianese,,,346,255,19326,2013-03-11 15:34:39,2020-06-12 06:01:48,13,"La #Destra ha deciso di non partecipare agli stati generali convocati da @GiuseppeConteIT per riavviare l'Italia dopo il Covid 19. Non mi sembra un comportamento responsabile, specialmente dopo essersi lamentati di non essere ascoltati nelle loro proposte","[{'text': 'Destra', 'indices': [20, 27]}]",,,
1271321712844365833,natixym,Bio-Logica,A nord del lago,722,4357,40296,2011-12-10 17:14:23,2020-06-12 06:01:31,0,@dirtom1 Sto aspettando i mobili della camera nuova ...in ritardo di due mesi causa Covid,[],,,
1271321708327141379,LombardiaInnova,Il network di @RegLombardia dedicato a #Ricerca e #Innovazione. Segui tutte le news e gli aggiornamenti dalla piattaforma! #LombardiaèRicerca,"Lombardia, Italia",836,2641,4142,2017-07-20 07:38:16,2020-06-12 06:01:29,0,"#OpenLombardia
Gli impatti della crisi #COVID-19 su scuola, tecnologie e commercio: quali saranno i 10 possibili scenari descritti da Massimiliano Jattoni Dall’Asén del @Corriere?
Scopri di più 👉 https://t.co/Z3U8i1JNtm https://t.co/56gSrAT6Fo","[{'text': 'OpenLombardia', 'indices': [0, 14]}, {'text': 'COVID', 'indices': [39, 45]}]",,,
1271321697304539137,occhio_notizie,"Quotidiano online

Edizioni locali: Napoli, Salerno, Avellino, Benevento, Caserta","Salerno, Campania",82,2786,73000,2013-11-15 16:30:31,2020-06-12 06:01:27,0,Un'altra mazzata per gli italiani https://t.co/nVTyId0l7W,[],,,
1271321670838411272,Pagliarafabio,Mi occupo si sport. Passione e lavoro coincidono. Grande fortuna .,,2369,2367,19063,2011-11-09 09:38:29,2020-06-12 06:01:20,3,"#atletica Lombardia, l'atletica simbolo di rinascita 🇮🇹 Viaggio nella regione più colpita dall’emergenza Covid-19 👉 l’emozione del rientro in pista, la gioia di rivedere gli amici, la prudenza sempre necessaria. E il 20 giugno le prime sfide

LEGGI ▶️ https://t.co/7EIyWNxP9F https://t.co/SGapIDMXKf","[{'text': 'atletica', 'indices': [20, 29]}]",,,
1271321665255772160,sergiopillai,,,638,87,2712,2017-04-26 15:07:38,2020-06-12 06:01:19,5,"“La Lega affonda la commissione di inchiesta sull’emergenza Covid-19 in Piemonte. Non vuole che venga approfondita la gestione della sanità in una delle regioni più colpite dal coronavirus. In Consiglio regionale era atteso il voto definitivo, ma il Carroccio si è tirato indietro https://t.co/G3cROUM95r",[],,,
1271321651813036032,M5SpiuL,Collaboratore domestico romanista,"Baranzate, Lombardia",2915,2952,43606,2013-03-22 09:14:00,2020-06-12 06:01:16,243,"Sindaco @giorgio_gori sono l'autore del pezzo uscito su @24infodata 
Confermo: dopo il nostro pezzo e dopo che @ondatait ha pubblicato i dati @RegLombardia ha chiuso l'accesso ai dati. Ho fatto richieste Foia per averli, non ha risposto.
Qui il pezzo: https://t.co/BmOiVUyzbc https://t.co/rl717RwdGb",[],,,
1271321648239501313,Imbuzz59,La felicità è un attimo che è già volato via #facciamorete,,1275,559,12956,2009-06-25 07:47:25,2020-06-12 06:01:15,0,"@giorgio_gori Mah, guardi, la storia Covid-19 della sua Regione, ha ben poco di normale:Piccolo comune della provincia di Sondrio, mi ha raccontato un conoscente che vi abita, avevano iniziato una campagna a tappeto di tamponi: non appena resosi conto che i positivi erano la maggioranza, stop!",[],,,
1271321634922614785,GalantoMassimo,"Giornalista e mille altre cose, tutte fatte male. Su @rtl1025 e @tvblogit (Blogo)",,2027,3778,31660,2012-03-03 12:23:00,2020-06-12 06:01:12,0,"Il 24 maggio su @tvblogit abbiamo spiegato quale fosse il ""problema"" dell'edizione vip di #TemptationIsland (contemporaneità con #gfvip e questione #covid). Al momento, unica certezza è la partenza della versione mix vip&amp;nip (scritto il 10 giugno su tvblog) condotta da Bisciglia. https://t.co/w0Ht6caF7x","[{'text': 'TemptationIsland', 'indices': [90, 107]}, {'text': 'gfvip', 'indices': [129, 135]}, {'text': 'covid', 'indices': [148, 154]}]",,,
1271321552106053633,Mariunsen,,Rome,510,54,3239,2009-04-28 20:41:09,2020-06-12 06:00:52,8,"Leggo e sento ovunque una sentita e urgente richiesta di ritornare alla normalità. Ecco, io vorrei evitare di ritornare alla normalità pre covid perché quella non era normalità.
Proviamo invece a essere migliori di prima, che non ci vuole poi molto.
Buongiorno normale, gente. https://t.co/6V1yb4Ebj2",[],,,
1271321537396633602,VanityFairIt,"Vanity Fair, in edicola e online - Quality is our Business Plan #CONDENASTQUALITY",Italy,861,314781,119654,2010-10-06 07:46:04,2020-06-12 06:00:49,0,Hanno perso i loro familiari e adesso vogliono la verità su quello che è davvero accaduto in Lombardia 😢 https://t.co/Z1wIeYhylo https://t.co/ysPDIMsBXL,[],,,
1271321511362654209,liberismorisor1,"L'ordine liberale lascia a ciascuno il compito di trovare, nella libertà, il senso della propria vita. (Raymond Aron)",,605,613,4775,2019-01-08 01:40:55,2020-06-12 06:00:42,1,"Pompare soldi in un sistema guasto non solo non serve, fa danno. 

Borse, le ragioni del crollo: non solo Covid. L’analisi dell'esperto - https://t.co/8FSdhWUD7s https://t.co/WuJ9ybgBJg",[],,,
1271321489640308738,luisa_pacelli,"Amo i libri, i gatti, il mare, la mia città. Inevitabilmente delusa dalla politica, ma sempre molto interessata.",,531,488,18687,2015-11-08 07:34:51,2020-06-12 06:00:37,8,"Leggo e sento ovunque una sentita e urgente richiesta di ritornare alla normalità. Ecco, io vorrei evitare di ritornare alla normalità pre covid perché quella non era normalità.
Proviamo invece a essere migliori di prima, che non ci vuole poi molto.
Buongiorno normale, gente. https://t.co/6V1yb4Ebj2",[],,,
1271321475971084288,SalvoBulgarella,"𝐻𝑜 𝒻𝒶𝓈𝓉𝒾𝒹𝒾𝑜 𝒹𝑒𝑔𝓁𝒾 𝐼𝒟𝐼𝒪𝒯𝐼
Business Development & GeoStrategy.
 Dakar, S. Paolo, Conakry, Cuba, Tonga, Maputo. Hanoi, Curitiba,",U.N.D.P.  Development Manager ,2543,1550,2438,2013-06-03 09:27:56,2020-06-12 06:00:34,0,"Buongiorno Adesso e così
#Trapani
scorci centro storico
Nessuno capisce  ancora perchè
tuttavia per fortuna Covid  da noi 
non ha attecchito nessun Contagio Autoctono
#Sicilia
#Estate
#Favignana
#Vacanze https://t.co/8ZTYnhUoaS","[{'text': 'Trapani', 'indices': [25, 33]}, {'text': 'Sicilia', 'indices': [167, 175]}, {'text': 'Estate', 'indices': [176, 183]}, {'text': 'Favignana', 'indices': [184, 194]}, {'text': 'Vacanze', 'indices': [195, 203]}]",,,
1271321448615829504,Afri_Radio,Many Colors... One Love,Verona - Italy,357,703,23672,2009-09-20 16:56:14,2020-06-12 06:00:28,0,"📣 New Podcast! """"Le navi da guerra italiane all'Egitto, attore di guerre sanguinose"""" on @Spreaker #africa #al_sisi #artemisia #cinchona #conte #coronavirus #coronavirusafrica #covid_19 #covid19 #covidorganics #cvo #dimaio #egitto #fregatefremm https://t.co/azEAzU4zF5","[{'text': 'africa', 'indices': [99, 106]}, {'text': 'al_sisi', 'indices': [107, 115]}, {'text': 'artemisia', 'indices': [116, 126]}, {'text': 'cinchona', 'indices': [127, 136]}, {'text': 'conte', 'indices': [137, 143]}, {'text': 'coronavirus', 'indices': [144, 156]}, {'text': 'coronavirusafrica', 'indices': [157, 175]}, {'text': 'covid_19', 'indices': [176, 185]}, {'text': 'covid19', 'indices': [186, 194]}, {'text': 'covidorganics', 'indices': [195, 209]}, {'text': 'cvo', 'indices': [210, 214]}, {'text': 'dimaio', 'indices': [215, 222]}, {'text': 'egitto', 'indices': [223, 230]}, {'text': 'fregatefremm', 'indices': [231, 244]}]",,,
1271321427430371335,JamesTa51096690,"SUB LEGE LIBERTA +++++

BIANCO",,214,179,6365,2020-03-08 11:54:35,2020-06-12 06:00:22,0,"@Massimo98616376 @51inif @GiuseppeConteIT Credo che #Palamara in questo caso non possa fare nulla, se il PM lavora bene sono cazzi di #Conte #Lamorgese e #Speranza 
Migliaia di morti chiedono giustizia. 
Militare in attesa di ordini per la zona rossa fermi in albergo, autopsie non autorizzate per la cura del covid ecc...","[{'text': 'Palamara', 'indices': [52, 61]}, {'text': 'Conte', 'indices': [134, 140]}, {'text': 'Lamorgese', 'indices': [141, 151]}, {'text': 'Speranza', 'indices': [154, 163]}]",,,
1271321419117289476,OrticaWeb,"L’Ortica nasce alla fine degli anni 90, in poco tempo diventa il periodico più letto dell’Alto Lazio, riferimento ogni venerdì per migliaia di lettori.",Cerveteri,232,543,22392,2012-09-19 15:55:22,2020-06-12 06:00:20,0,Covid-19 -qual è la situazione attuale? https://t.co/AWxvxYWieF,[],,,
1271321349517000709,giga_73,"Un posto pulito tenderà a restare pulito, un posto sporco tenderà a diventare ancora più sporco!",,229,99,5696,2019-07-21 19:26:40,2020-06-12 06:00:04,26,"Io spero che si trovi una soluzione, altrimenti andremo in Corte Costituzionale e faremo i fuochi d’artificio! Siamo senza medici, il governo ne fa assumere centinaia per l’emergenza Covid e poi blocca un corso di laurea destinato a sfornare giovani e bravi professionisti...",[],,,
1271321334803382273,sulromanzo,Agenzia letteraria che ama i libri e le storie #staseraleggo,"Vicenza, Italia",634,35315,56206,2009-06-18 13:49:41,2020-06-12 06:00:00,2,Un romanzo scritto prima che arrivasse il Covid 19 ma che racconta una pandemiacome quella che stiamo vivendo https://t.co/QCM4xgzmeB @sulromanzo @edizpiemme https://t.co/u1gaDnrZfL,[],,,
1271321333729652736,TGTGTV2000,Programma d’informazione che commenta e analizza titoli e fatti del giorno. Con @FabioBolzetta e @KatiusHD dal lunedì al giovedì 20.50- 21.10 su @TV2000it,Roma,657,11026,14806,2010-01-28 09:41:11,2020-06-12 06:00:00,0,"#Sanità #COVID19 
A #SpecialeTGtg #coronavirus Marco Elefanti, Direttore fondazione Policlinico Gemelli.
L'eperienza del #Covid cosa  lascia nel tipo di organizzazione dell'ospedale e del personale?

@TV2000it @FabioBolzetta @vinmorgante @uffstampaTv2000","[{'text': 'Sanità', 'indices': [0, 7]}, {'text': 'COVID19', 'indices': [8, 16]}, {'text': 'SpecialeTGtg', 'indices': [20, 33]}, {'text': 'coronavirus', 'indices': [34, 46]}, {'text': 'Covid', 'indices': [121, 127]}]",,,
1271321306961555466,caterinacorda1,,,218,687,130723,2014-03-13 15:52:16,2020-06-12 05:59:54,3,Alternativa:Vogliamo farcele delle domande o no? Covid-19 truffa biologica? https://t.co/Lb3TXQY1VF 45,[],,,
1271321304730234880,Simo_Dal,"Giornalista (#журналистка), scrivo di #lavoro e #pensioni su @Agenzia_Ansa e @ItaliaOggi. Leggo tanto, tifo @OfficialASRoma, amo il #pilates e i frutti di bosco","Roma, Città Eterna-Caput Mundi",1688,1900,6201,2011-08-11 07:09:19,2020-06-12 05:59:53,0,Il 20% dei #professionisti (dato forse«sottostimato») rischia la definitiva espulsione dal mercato del #lavoro: l'emergenza Covid-19 ha minato il loro già #fragile tessuto produttivo. In #primapagina su @ItaliaOggi in #edicola @stampaadepp #ordini #casse #welfare #previdenza https://t.co/JrSYXvkGJD,"[{'text': 'professionisti', 'indices': [11, 26]}, {'text': 'lavoro', 'indices': [103, 110]}, {'text': 'fragile', 'indices': [155, 163]}, {'text': 'primapagina', 'indices': [187, 199]}, {'text': 'edicola', 'indices': [218, 226]}, {'text': 'ordini', 'indices': [240, 247]}, {'text': 'casse', 'indices': [248, 254]}, {'text': 'welfare', 'indices': [255, 263]}, {'text': 'previdenza', 'indices': [264, 275]}]",,,
1271321269414187008,AmedeoPrincipe,,"Ottaviano, Napoli",495,180,5109,2011-09-02 16:52:23,2020-06-12 05:59:45,0,@Mr_Mrk1 @biundulella Tu! Il matrimonio era il 27 agosto. A causa del covid è stato spostato... 8 agosto... E io song' o' cumpàr',[],,,
1271321261637898250,MaxMangione,Dolcemente stanco.  https://t.co/nP7z3Hpa5b,Venessia                      ,462,37635,32480,2013-12-06 19:35:42,2020-06-12 05:59:43,4,Tra covid e 5G esiste la stessa correlazione che c’è tra alzare il volume della tv per far bollire prima l’acqua per la pasta.,[],,,
1271321254344028161,LorenaLVilla,"Letteratura, politica e libertà in ordine inverso 🔸Imprenditrice 🔸Liberale🔸Federalista 🔸Fondazione Luigi Einaudi Onlus 🔸villa@fondazioneluigieinaudi.it",Milano,2689,6050,33573,2009-09-26 09:24:26,2020-06-12 05:59:41,1,"Pompare soldi in un sistema guasto non solo non serve, fa danno. 

Borse, le ragioni del crollo: non solo Covid. L’analisi dell'esperto - https://t.co/8FSdhWUD7s https://t.co/WuJ9ybgBJg",[],,,
