id,username,acctdesc,userlocation,following,followers,totaltweets,usercreatedts,tweetcreatedts,retweetcount,text,hashtags,lat,lon,placeName
1271311730371522560,Flosta5,"Stupendo! Adoro anche il gerundio.
Magari solo per piccole cose.","2a stella a destra, poi dritto",4752,5653,112418,2012-02-09 16:09:01,2020-06-12 05:21:51,0,"Figlio1 è uscito sbadigliando per andare a scuola e io torno a letto e mi faccio un sonnellino.

Che brutta la vita del telelavoratore post covid.",[],,,
1271311662075637761,marmaz,"Milano, biciclette e viaggi. In bici a scuola con Massa Marmocchi. Il Corvetto e le meraviglie di AbbracciaMI. In love with technology.","Milano, Italy",3170,5485,22795,2007-01-09 08:54:07,2020-06-12 05:21:34,258,"Dopodiché dite voi se è normale che questi dati non vengano normalmente comunicati, e se ancora oggi i sindaci lombardi siano del tutto all’oscuro sul numero dei positivi #Covid dei loro comuni.",[],,,
1271311635089522690,SimoneBo7,,,129,26,1891,2020-01-23 15:54:38,2020-06-12 05:21:28,244,"Sindaco @giorgio_gori sono l'autore del pezzo uscito su @24infodata 
Confermo: dopo il nostro pezzo e dopo che @ondatait ha pubblicato i dati @RegLombardia ha chiuso l'accesso ai dati. Ho fatto richieste Foia per averli, non ha risposto.
Qui il pezzo: https://t.co/BmOiVUyzbc https://t.co/rl717RwdGb",[],,,
1271311617607659520,giovgiorgetti,🇮🇹 Con Orgoglio e Coraggio affronto la vita e l'impresa!,Ceo & Founder ESG89 Group,1272,503,8769,2014-04-11 12:43:16,2020-06-12 05:21:24,0,"Nel merito, i contenuti del primo documento sono senz’altro opportuni, considerato che, come è naturale, sia le amministrazioni sia gli operatori economici beneficerebbero grandemente #anac #pianoColao https://t.co/SZ4hbgMKFb","[{'text': 'anac', 'indices': [184, 189]}, {'text': 'pianoColao', 'indices': [190, 201]}]",,,
1271311613090381827,papillonpa,IL FUTURO DELL'EUROPA E' DEI CITTADINI ONESTI,Italia,60,237,29429,2013-07-15 15:35:17,2020-06-12 05:21:23,0,"COVID-19 E I POLITICI ITALIANI FANNULLONI- Dobbiamo smetterla di parlare, parlare , parlare e ancora parlare senza fatti concreti. Sappiamo tutti che i politici stanno lì per tornaconto personale . Aivoglia sentire , Matteo Salvini, Meloni , Tajani .... tanto questi tre ultimi...",[],,,
1271311530416500739,lucaravazzolo,,,489,151,2141,2009-06-19 13:32:30,2020-06-12 05:21:03,2,"In tempi di crisi, le persone di tutto il mondo si adoperano  per il bene comune. Uno dei paesi più colpiti durante la crisi #Covid_19  è stata l'Italia. Il nostro fantastico team, guidato da Alessandro, ha lavorato strenuamente. #RisingToTheChallenge https://t.co/QUDdc0wHNu",[],,,
1271311505548427267,Lia17564478,Serena ma non troppo...,Italia,934,573,8693,2017-03-01 19:46:38,2020-06-12 05:20:57,6,"Al Pio Albergo Trivulzio il direttore generale Giuseppe Calicchio nominato da lega nord e amico di Salvini e Fontana nascondeva i morti da covid-19
La direzione del Pio,oltre milletrecento anziani ricoverati, per tutto il mese di marzo ha occultato la diffusione del Covid-19 https://t.co/ftiBWf34QS",[],,,
1271311490851561474,MattoneSelvagg1,,,67,5,159,2019-02-19 06:27:00,2020-06-12 05:20:53,0,"@LuigiGallo15 Pagate degli insegnanti seri non le capre che girano in Italia, e smettiamola di dire che la scuole va rinnovata per il covid, va rinnovata per il nostro futuro, con o senza covid.",[],,,
1271311438020141056,alcinx,Piu’ #agraria🔬🌳🍷🌳🌹🐞☄️🌾 🐱🐶🦊 che giornalista 💻@odglombardia Mummy 👩‍👦 #STEMM 🧬 @sulleregole⚖️ #volunteer @cri_milano @IveserVenezia #HumanRights 🌍,"#Lombardia, Italia❣️",1916,994,282914,2011-10-11 21:28:23,2020-06-12 05:20:41,2,"Il primario Maria Adele Moschella è arrivata ad avere 57 posti letto di pazienti positivi: “Siamo andati avanti grazie alla collaborazione tra veterani ed esperti”.

https://t.co/cTqU18RXGa",[],,,
1271311332923432960,MarinellaUrso1,Osservo la natura in ogni suo infinitesimo dettaglio. #scienzenaturali #cinema #politica #libertà #GiulioRegeni sostengo @giuliosiamonoi,N 40°20' 0'' / E 18°10' 0'',1701,775,7506,2012-02-07 12:15:25,2020-06-12 05:20:16,1613,"Leggo che in #Lombardia ieri ci sono stati 32 decessi per #Covid. Non si sa però dove, in quale provincia, perché la Regione non comunica + i dati divisi.
Da quando abbiamo segnalato che i decessi reali erano molti di + di quelli “ufficiali”, hanno secretato i dati per provincia.","[{'text': 'Lombardia', 'indices': [31, 41]}, {'text': 'Covid', 'indices': [76, 82]}]",,,
1271311303018070019,mari7135919044,,"Livorno, Toscana",70,32,257,2019-10-25 05:22:19,2020-06-12 05:20:09,12,"L' INPS per rilasciare il DURC regolare, vuole avere il pagamento del mese di Marzo,Aprile e Maggio.
Ma se c'è stata l'emergenza Covid-19, come fa un'impresa a regolarizzare il tutto senza liquidità essendo rimasta chiusa?
Governo inadeguato e ridicolo.
#DrittoeRovescio",[],,,
1271311300170153985,LaStampa,"Notizie, inchieste, analisi e breaking news. RT dei nostri giornalisti e lettori","Torino, Piemonte",391,1125117,437984,2009-04-07 09:31:23,2020-06-12 05:20:08,1,"Professor Spence, lei ha detto che l’economia globale si trova ad affrontare un enorme shock negativo dopo il Covid; che ci troviamo di fronte a un percorso molto accidentato e ben poco piacevole, per via di questa crisi, che verrà seguito da .

https://t.co/kdyujqWAIn",[],,,
1271311294281351170,marcolfa_doc,,Reggio nell'Emilia,11,13,188,2018-03-10 09:21:24,2020-06-12 05:20:07,0,"@mariaxoia @matteosalvinimi Dici che la deputata del PD Alessandra dovrà cambiar cognome ? Chissà come avrà fatto pverella senza estetista durante il Covid ""lookdown""",[],,,
1271311269543374849,raffiaba,????,"Bergamo, Lombardia",818,521,18296,2015-06-24 21:37:07,2020-06-12 05:20:01,64,"@giorgio_gori: comunicazione decessi in forma aggregata (senza distinzione Province) e mix ""Dimessi/Guariti"" sono due fenomeni di gaming in #Lombardia rilevati da @GIMBE. 
#iostocongimbe  
#COVID https://t.co/nJFEve2y9q",[],,,
1271311250102910976,DSTommaso,"Seguo la politica  e L'ECOLOGIA da sempre, invecchio e spero che questo ns.mondo cambi, non per me ma almeno per i ns figli. (P.S. La barca non è mia purtroppo)",,2321,1229,8209,2018-04-08 06:43:30,2020-06-12 05:19:56,1,"Caro Franco, non avverrà nulla perché il valore delle vite umane oggi è abbastanza basso, vale poco in Italia (vedi covid e RSA) figurati per quei disperati che arrivano dal continente africano, tristezza https://t.co/jXaodLgiUk",[],,,
1271311227961004034,LaStampa,"Notizie, inchieste, analisi e breaking news. RT dei nostri giornalisti e lettori","Torino, Piemonte",391,1125117,437984,2009-04-07 09:31:23,2020-06-12 05:19:51,0,"L’azienda di Brescia vince il primo premio di C-Heroes per mappare e contrastare i danni psicologici della pandemia.

https://t.co/QhuHEKzej1",[],,,
1271311207794761728,scuolainforma,Portale d'informazione scolastica,Roma,477,1393,7768,2015-04-11 14:12:48,2020-06-12 05:19:46,0,"#Covid19, #Conte firma #decreto fase 3: #appimmuni e family act tra le novità https://t.co/Tr8T58yXMU","[{'text': 'Covid19', 'indices': [0, 8]}, {'text': 'Conte', 'indices': [10, 16]}, {'text': 'decreto', 'indices': [23, 31]}, {'text': 'appimmuni', 'indices': [40, 50]}]",,,
1271311118422564865,mg_marinagemma,"✨Con le radici a Sud e la testa altrove✨

#socialpercaso","Matera, Basilicata",191,111,289,2016-12-01 18:49:22,2020-06-12 05:19:25,1613,"Leggo che in #Lombardia ieri ci sono stati 32 decessi per #Covid. Non si sa però dove, in quale provincia, perché la Regione non comunica + i dati divisi.
Da quando abbiamo segnalato che i decessi reali erano molti di + di quelli “ufficiali”, hanno secretato i dati per provincia.","[{'text': 'Lombardia', 'indices': [31, 41]}, {'text': 'Covid', 'indices': [76, 82]}]",,,
1271311053637419008,GiovinazzoLive,Il primo giornale telematico della città di Giovinazzo,Giovinazzo,0,407,12197,2011-08-22 09:09:56,2020-06-12 05:19:09,0,#Giovinazzo Plasma iperimmune per curare il Covid https://t.co/Q826g4ffwx,"[{'text': 'Giovinazzo', 'indices': [0, 11]}]",,,
1271311033005563905,LaStampa,"Notizie, inchieste, analisi e breaking news. RT dei nostri giornalisti e lettori","Torino, Piemonte",391,1125117,437984,2009-04-07 09:31:23,2020-06-12 05:19:04,2,"Il primario Maria Adele Moschella è arrivata ad avere 57 posti letto di pazienti positivi: “Siamo andati avanti grazie alla collaborazione tra veterani ed esperti”.

https://t.co/cTqU18RXGa",[],,,
1271311014538047490,LaStampa,"Notizie, inchieste, analisi e breaking news. RT dei nostri giornalisti e lettori","Torino, Piemonte",391,1125117,437984,2009-04-07 09:31:23,2020-06-12 05:19:00,0,"Raddoppia il Torino-Reggio Calabria, effetto Covid per i Frecciarossa.

https://t.co/3h3gKS3H8b",[],,,
1271311006560468995,Gio_Donatini,,,19,15,1759,2013-03-17 12:11:11,2020-06-12 05:18:58,49,Nelle ultime settimane le Regioni han ridotto i tamponi del 20% a partire dalla Lombardia. E a Roma dilaga il focolaio in una Rsa. Sicuri che il Covid sia vinto? [LEGGI https://t.co/hDml9tRubQ] #FattoQuotidiano #edicola #11giugno https://t.co/7eXG9rYZVq,[],,,
1271310858967113728,IvanaRicci2,,,51,47,2338,2019-08-30 10:23:36,2020-06-12 05:18:23,292,"Comunque ho parlato con un amico in Cina, ha detto che è meglio non prendere il COVID-19 perché a Settembre esce il 20... Con più funzioni.",[],,,
1271310842793869312,JayRWilsonUSA,Building communities of trust. Innovation to serve the public interest. For info contact @ramirezpartners,"Santa Monica, CA",23794,144205,121156,2009-02-18 16:03:07,2020-06-12 05:18:19,6,"Thimus, le neuroscienze contro il Covid https://t.co/cEuiHs01nf",[],,,
1271310838939504641,Magamag76377872,,,86,169,6849,2019-11-12 12:58:29,2020-06-12 05:18:18,111,È da ieri che ai tg si sta parlando di una nuova ondata di Covid in arrivò e nuovi focolai!!!!! Vi rendete conto....di cosa vogliono fare????,[],,,
1271310832119328769,teresacapitanio,,CIVIDINO ( BG ),784,212,24538,2012-05-24 21:36:51,2020-06-12 05:18:16,0,"Sanificazione auto, spunta la tassa Covid «Pratica illegale, segnalate certi episodi» https://t.co/EqOVzjzZTo",[],,,
1271310773587869696,LaStampa,"Notizie, inchieste, analisi e breaking news. RT dei nostri giornalisti e lettori","Torino, Piemonte",391,1125117,437984,2009-04-07 09:31:23,2020-06-12 05:18:02,0,Emergenza Covid nel Novarese: “Il peggio è finito ma il virus è ancora qui” https://t.co/2Ro0mJztAQ,[],,,
1271310739538468866,gianlucav77,pugliese di nascita trapiantato a Milano ma sempre con la voglia di scoprire il mondo,"Milano, Lombardia",237,56,4225,2015-03-23 21:26:51,2020-06-12 05:17:54,890,"#Covid_19, per mettere fine alla propaganda di regime #Bolsonaro manda la polizia per controllare le sepolture,,,, e guardate cosa scoprono!!!
#ArrestateliTutti https://t.co/N6y1rHAxTl","[{'text': 'Covid_19', 'indices': [19, 28]}, {'text': 'Bolsonaro', 'indices': [73, 83]}]",,,
1271310734715019264,MartaAbbiati,Perfettamente imperfetta,Varese ,648,975,24180,2015-04-04 10:26:43,2020-06-12 05:17:53,8,"Leggo e sento ovunque una sentita e urgente richiesta di ritornare alla normalità. Ecco, io vorrei evitare di ritornare alla normalità pre covid perché quella non era normalità.
Proviamo invece a essere migliori di prima, che non ci vuole poi molto.
Buongiorno normale, gente. https://t.co/6V1yb4Ebj2",[],,,
1271310560148275200,GiovangiacomoL,Marito e padre. Sciabolatore matto per la scherma.  Livorno nel cuore! Scrivo senza pretese su https://t.co/PyHnMYuwgj,,1000,47,357,2020-05-10 15:52:28,2020-06-12 05:17:12,8,"Leggo e sento ovunque una sentita e urgente richiesta di ritornare alla normalità. Ecco, io vorrei evitare di ritornare alla normalità pre covid perché quella non era normalità.
Proviamo invece a essere migliori di prima, che non ci vuole poi molto.
Buongiorno normale, gente. https://t.co/6V1yb4Ebj2",[],,,
1271310553294598151,tamaraxel,,,130,11,253,2015-04-16 15:14:09,2020-06-12 05:17:10,0,"@INPS_it @CatalfoNunzia @PTridico @GiuseppeConteIT 
Oggi 12 giugno si pagherà cassa integrazione,il rem,i bonus covid ecc....
E poi c'è chi al 12 giugno aspetta la vostra circolare per la proroga Naspi......
Siete incoerenti!! esistiamo anche noi",[],,,
1271310501490851840,RaiolaPatrizia,curiosa profonda pensierosa,,310,54,577,2020-02-14 17:26:17,2020-06-12 05:16:58,1613,"Leggo che in #Lombardia ieri ci sono stati 32 decessi per #Covid. Non si sa però dove, in quale provincia, perché la Regione non comunica + i dati divisi.
Da quando abbiamo segnalato che i decessi reali erano molti di + di quelli “ufficiali”, hanno secretato i dati per provincia.","[{'text': 'Lombardia', 'indices': [31, 41]}, {'text': 'Covid', 'indices': [76, 82]}]",,,
1271310269373976576,Carmen36051956,,,712,524,7542,2018-11-01 06:24:02,2020-06-12 05:16:02,18,"#Fraccaro: 200 mln per il reddito energetico, che servirà per sostenere le spese dell’installazione dei pannelli fotovoltaici per le famiglie in difficoltà. 

Poi dall’altra parte pensano di aumentare le bollette energetiche con una tassa Covid. Voi lo capite ?

@VotersItalia","[{'text': 'Fraccaro', 'indices': [20, 29]}]",,,
1271310213245571080,russellgduke,,,78,131,22813,2012-10-19 13:23:44,2020-06-12 05:15:49,890,"#Covid_19, per mettere fine alla propaganda di regime #Bolsonaro manda la polizia per controllare le sepolture,,,, e guardate cosa scoprono!!!
#ArrestateliTutti https://t.co/N6y1rHAxTl","[{'text': 'Covid_19', 'indices': [19, 28]}, {'text': 'Bolsonaro', 'indices': [73, 83]}]",,,
1271310160024109057,Bobbio65M,"Convintissimo dal 2015 su Tw. LN-FDI ma comunque sostenitore, di tutto ciò  non sia sx. Un augurio a questa ITALIA!! No LeU, no PD e compagnia bella.",,3422,3495,270541,2015-07-09 18:21:25,2020-06-12 05:15:36,126,"In Germania si chiedono se il COVID fosse una vera pandemia o solo una brutta influenza derivante da uno dei tanti virus. Sono morte 250 mila persone di COVID contro  1.500.000  di influenza degli anni precedenti. Valeva la pena bloccare l'economia? 
https://t.co/a6p2Np9mM1",[],,,
1271309963831341059,insopportabile,"Ne ho le scatole piene, ma con eleganza.","Sardinia, Italy",37211,137708,190491,2009-05-14 06:19:15,2020-06-12 05:14:49,8,"Leggo e sento ovunque una sentita e urgente richiesta di ritornare alla normalità. Ecco, io vorrei evitare di ritornare alla normalità pre covid perché quella non era normalità.
Proviamo invece a essere migliori di prima, che non ci vuole poi molto.
Buongiorno normale, gente. https://t.co/6V1yb4Ebj2",[],,,
1271309867756601349,salfasanop,European of italian nationality. Se mi chiamano buonista metto mano alle colt.,,1878,1621,68571,2018-03-07 17:56:45,2020-06-12 05:14:26,5,"“I malati Covid? Metteteli nelle case di riposo.”
Questa è l’incredibile delibera firmata l’8 marzo scorso da Regione Lombardia e dal suo governatore Attilio Fontana. Di cui solo oggi si conoscono i dettagli, e soprattutto i tragici risultati. 
Una richiesta folle, sciagurata.",[],,,
1271309821854117889,alcinx,Piu’ #agraria🔬🌳🍷🌳🌹🐞☄️🌾 🐱🐶🦊 che giornalista 💻@odglombardia Mummy 👩‍👦 #STEMM 🧬 @sulleregole⚖️ #volunteer @cri_milano @IveserVenezia #HumanRights 🌍,"#Lombardia, Italia❣️",1916,994,282914,2011-10-11 21:28:23,2020-06-12 05:14:15,1,"Covid-19, 40 milioni per la Catena della solidarietà https://t.co/hF8GpkmLq3",[],,,
1271309759552139264,Domenic20508867,,,829,575,31658,2016-02-03 18:39:46,2020-06-12 05:14:01,4,"@Mov5Stelle Siete degli imbecilli oltre che dei bastardi che si son fatti votare per l'opposto di quel che stan facendo

https://t.co/Yhk1QLTJbs

https://t.co/DafgJfcg1X

https://t.co/gVTw7BGkEs",[],,,
1271309751687819264,YvonnePizzigati,Lasciati trovare dalla Felicità!,Torino,232,87,747,2012-10-18 12:03:51,2020-06-12 05:13:59,28,"Normativa anti-COVID per il calcetto e il basket in regione Abruzzo, che ricordo essere governata da uno di Fratelli d'Italia

""La palla deve essere sottratta all'avversario, senza alcun contrasto o contatto fisico e va toccata solo con i guanti""
Ahahahaha!
#mavaffanculo",[],,,
1271309652244955136,MauroBiasolo,Bringing #blockchain and #AI products to market,"Vicenza, Veneto",14285,28621,11139,2011-09-20 15:14:43,2020-06-12 05:13:35,0,@Milestemplaris Clickday per rimborsi spese covid: dopo qualche  secondo era già full. Trovate partite Iva scadute da 14 anni... tra l altro tutti a chiedere rimborsi con cifre belle tonde :),[],,,
1271309648180772864,simonamuntoni,Io non sono cattiva: è che mi disegnano così!,"Milan, Italy",1585,339,7035,2009-12-16 16:49:07,2020-06-12 05:13:34,21,La proibizione dei popcorn al cinema dovrebbe essere estesa anche una volta finita l'emergenza Covid.,[],,,
1271309645806628864,INGFiore2,"Movie: Once upon a time in America
 
bloccato da @Borghi_Claudio e #Capezzone #iostoconGratteri #autism #facciamorete

https://t.co/EFnxrTaHy0",Italia,5311,4933,13873,2016-08-25 09:12:35,2020-06-12 05:13:34,6,"Al Pio Albergo Trivulzio il direttore generale Giuseppe Calicchio nominato da lega nord e amico di Salvini e Fontana nascondeva i morti da covid-19
La direzione del Pio,oltre milletrecento anziani ricoverati, per tutto il mese di marzo ha occultato la diffusione del Covid-19 https://t.co/ftiBWf34QS",[],,,
1271309632242200576,chrean,Backend developer. Builds software. Stargazer. Woodworker. Views and tweets are my own.,Italy,1370,791,10998,2009-01-28 07:14:23,2020-06-12 05:13:30,0,"Il Covid è un complotto.
George Floyd è un complotto.
Quasi preferivo i terrapiattisti e i novax.",[],,,
1271309552210735106,ParrocchiaF,La Parrocchia San Felice in Pincis e la Rettoria del Carmine sono anche su twitter...,Pomi,582,172,18825,2018-05-28 11:09:33,2020-06-12 05:13:11,13,"Il Covid ha mostrato i lati negativi della #globalizzazione: ha messo in ginocchio Europa e Usa perché da anni, per le delocalizzazioni, dipendono dalle forniture cinesi, bloccate per il virus.
Inchiesta #Dataroom @Corriere di @M_gabanelli e Luigi Offeddu
https://t.co/OyS7ljcOZk","[{'text': 'globalizzazione', 'indices': [64, 80]}]",,,
1271309536477933570,vaniacavi,"Se il mio tempo mi vuole avversare, lo lascio fare tranquillamente. Io vengo da altri tempi, e in altri spero di andare»(Franz Grillparzer) #PAFI",,6783,7136,379787,2012-01-27 18:31:48,2020-06-12 05:13:07,55,"Si, faremo i Pronto Soccorso dedicati al Covid 19. Chi arriva per un infarto dovrà andare in quelli sovraffollati a causa dei vostri tagli. Ma perché non mettiamo anche le giostrine per i bambini con distributori di popcorn? Visto che lavori così bene con la fantasia?
#Mes https://t.co/B6DNACqt5X",[],,,
1271309476604391424,Mania48Mania53,"Leggo molto e ascolto con attenzione chiunque tranne gli imbecilli
Amo sempre più l'Italia e spero ancora si possa salvare","Milano, Lombardia",1688,2476,263177,2012-12-04 09:01:18,2020-06-12 05:12:53,890,"#Covid_19, per mettere fine alla propaganda di regime #Bolsonaro manda la polizia per controllare le sepolture,,,, e guardate cosa scoprono!!!
#ArrestateliTutti https://t.co/N6y1rHAxTl","[{'text': 'Covid_19', 'indices': [19, 28]}, {'text': 'Bolsonaro', 'indices': [73, 83]}]",,,
1271309421226815488,jacques_jj6592,"Essere se stessi è una virtù dei bambini,dei matti e dei solitari. (Fabrizio De Andrè)","Moncalieri, Piemonte",1253,973,67488,2016-07-31 11:49:25,2020-06-12 05:12:40,1613,"Leggo che in #Lombardia ieri ci sono stati 32 decessi per #Covid. Non si sa però dove, in quale provincia, perché la Regione non comunica + i dati divisi.
Da quando abbiamo segnalato che i decessi reali erano molti di + di quelli “ufficiali”, hanno secretato i dati per provincia.","[{'text': 'Lombardia', 'indices': [31, 41]}, {'text': 'Covid', 'indices': [76, 82]}]",,,
1271309369594933252,GermanaGea,,"Verona, Veneto",67,276,15447,2017-07-05 10:57:15,2020-06-12 05:12:28,1613,"Leggo che in #Lombardia ieri ci sono stati 32 decessi per #Covid. Non si sa però dove, in quale provincia, perché la Regione non comunica + i dati divisi.
Da quando abbiamo segnalato che i decessi reali erano molti di + di quelli “ufficiali”, hanno secretato i dati per provincia.","[{'text': 'Lombardia', 'indices': [31, 41]}, {'text': 'Covid', 'indices': [76, 82]}]",,,
1271309352469585921,INGFiore2,"Movie: Once upon a time in America
 
bloccato da @Borghi_Claudio e #Capezzone #iostoconGratteri #autism #facciamorete

https://t.co/EFnxrTaHy0",Italia,5311,4933,13873,2016-08-25 09:12:35,2020-06-12 05:12:24,5,"“I malati Covid? Metteteli nelle case di riposo.”
Questa è l’incredibile delibera firmata l’8 marzo scorso da Regione Lombardia e dal suo governatore Attilio Fontana. Di cui solo oggi si conoscono i dettagli, e soprattutto i tragici risultati. 
Una richiesta folle, sciagurata.",[],,,
1271309303786254336,IulianoLorenza,"Giornalista pubblicista, linguista, politologa, web master, esperta di comunicazione e SEO.","Napoli, Campania",71,18,5456,2015-07-04 21:29:28,2020-06-12 05:12:12,0,"Missionari PIME per vittime Covid America Latina, Asia, Africa, Oceania - https://t.co/M0yWOD3a1g https://t.co/t74X3gtfgj",[],,,
1271309298404978688,ExPartibus,La tua voce. Testata on-line di informazione e cultura.,,17,147,40349,2012-11-01 09:33:24,2020-06-12 05:12:11,0,"Missionari PIME per vittime Covid America Latina, Asia, Africa, Oceania - https://t.co/xfh3Krf407 https://t.co/lBNEkIMpyp",[],,,
1271309293086629890,pietro_riccio,In missione per conto di Dio,Everywhere,68,193,89551,2012-02-26 20:41:38,2020-06-12 05:12:09,0,"Missionari PIME per vittime Covid America Latina, Asia, Africa, Oceania - https://t.co/1MuYjoUMEn https://t.co/58DUpLPsMn",[],,,
1271309231040327680,parpinux,Giornalista freelance. SC Qualità Formazione Privacy e Relazioni con il Pubblico Fondazione IRCCS Istituto Nazionale dei Tumori. Qui solo opinioni personali :-),"Milano, Lombardia",487,742,8701,2015-05-12 05:47:23,2020-06-12 05:11:55,0,La tragica conferma: il #Covid_19 ha cancellato una generazione che rappresentava la nostra preziosa e insostituibile memoria collettiva. Ora superiamo le polemiche e rendiamo più sicure tutte Rsa. Proteggiamo gli anziani e con loro anche la nostra identità @rep_milano https://t.co/cGaNCq4PED,"[{'text': 'Covid_19', 'indices': [24, 33]}]",,,
1271309169908310016,antoninobill,,,3284,3460,152655,2013-08-15 05:41:13,2020-06-12 05:11:40,0,"Covid, in Piemonte la Lega nega commissione d’inchiesta sulla gestione dell’emergenza: sarà solo un gruppo di lavoro (con pochi poteri) https://t.co/XO1XQmYS7D via @fattoquotidiano",[],,,
1271309110919655425,marco_iannone1,,Italia,1591,239,9231,2014-12-18 10:03:07,2020-06-12 05:11:26,0,"@AugustoMinzolin @king_artour i finanziamenti covid, non si possono assimilare ai soldi pubblici presi da tutte testa di merda come libero il giornale la verità è cosa ben diversa",[],,,
1271309007936827399,LuigiColline,"Cittadino italiano 🇮🇹 Costituzione, uscITA, no €, RT se interessante, guarda la luna non la manicure","Firenze, Toscana",600,92,4087,2020-03-22 21:57:51,2020-06-12 05:11:01,63,"""Con le autopsie che il ministero non voleva fare abbiamo scoperto come uccide il coronavirus"" 
Ribadisco che il rischio trombosi si poteva vedere anche da alcuni esami del sangue. Con il paziente  in vita. Qualche medico può scrivere in merito? #covid_19 https://t.co/W3pW9FfGlM",[],,,
1271308889833615365,antoninobill,,,3284,3460,152655,2013-08-15 05:41:13,2020-06-12 05:10:33,0,"Università, Almalaurea: “Scende l’occupazione tra i neolaureati (-9%) dopo l’emergenza Covid. Il 47% pronto ad andare all’estero per lavorare” https://t.co/b0DvCAtAjF via @fattoquotidiano",[],,,
1271308868023316480,laregione,"Il quotidiano della Svizzera italiana. Con sede principale a Bellinzona, nasce nel 1992 dalla fusione degli storici giornali 'Il Dovere' e 'L'Eco di Locarno'.",Ticino-Switzerland,69,7686,93544,2009-07-04 06:44:12,2020-06-12 05:10:28,1,"Covid-19, 40 milioni per la Catena della solidarietà https://t.co/hF8GpkmLq3",[],,,
1271308842408673281,GioRomanoRai,Journalist @Raiofficialnews @TgrMolise @fnsisocial Views are my own Rt ≠ endorsement #EuropeanUnion #journalism360,Earth,1737,768,4692,2012-02-14 22:30:32,2020-06-12 05:10:22,1,"Alle 7:40 #BuongiornoRegione
La vitalità dei mercati: diretta da Cep #Campobasso
#bollettino #COVID Buone notizie
#CorpusDomini Il ""Mistero perduto""
#cultura Riprendono esposizioni alla Gil 
anche in streaming su https://t.co/M1uDNe9IBM
#IoSeguoTgr https://t.co/wqdncTnfI8","[{'text': 'BuongiornoRegione', 'indices': [25, 43]}, {'text': 'Campobasso', 'indices': [84, 95]}, {'text': 'bollettino', 'indices': [96, 107]}, {'text': 'COVID', 'indices': [108, 114]}]",,,
1271308804714409985,FertGiuseppe,FERT - Fortitudo Eius Rhodum Tenuit - Avanti Savoia! Monarchico e Liberale. W l'Italia   https://t.co/4YraIYMU1S,,339,147,2955,2018-10-18 09:58:45,2020-06-12 05:10:13,0,"@roma_paoletta @giorgio_gori @NunziaCentanni La colpa dei morti?
https://t.co/PaE5sYVTqo",[],,,
1271308756786319360,generacomplotti,"Generatore ossessivo di complotti casuali inventati su https://t.co/ninq1GqDAl.
Aggregatore compulsivo di tweet veri/falsi su #complotti #fakeNews #bufale.",Italia,198,222,18893,2020-04-11 20:13:41,2020-06-12 05:10:02,1,"Covid-19 virus della paura', un 'vaccino anti-fake news'

coautore:
Massimo Andreoni, primario del reparto di Malattie infettive del policlinico… https://t.co/cMipVj4gV7",[],,,
