id,username,acctdesc,userlocation,following,followers,totaltweets,usercreatedts,tweetcreatedts,retweetcount,text,hashtags,lat,lon,placeName
1271225753015848967,ugofonzar,studioFonzar & Partners srl - questi sono i tweet del blog di http://t.co/pkLr3nHDMo,,11,328,10268,2011-10-13 23:16:17,2020-06-11 23:40:12,0,Nicola Canal: viaggiare in auto con il Covid-19 https://t.co/uinjwSRM3L,[],,,
1271225737765363713,LuiNardi,"E' dura. Infatti aspiro all'essenziale.
It's hard. Ideed I aspire to the essential.",Perugia - Italy,4867,4244,54827,2012-10-26 13:49:34,2020-06-11 23:40:08,3,"Protocollo italiano:
le mascherine servono solo per i malati e asintomatici
Non puoi sapere di essere malato o asintomatico,quindi obbligo mascherine
Bisogna rintracciare il vero pericolo:gli asintomatici
OMS:gli asintomatici non contagiano
#nonunagiusta  
https://t.co/8YyNOIZjWA",[],,,
1271225700163469314,Tanzen,"Editor @Dissapore, il mio nuovo progetto è https://t.co/W61BisUxVT
•
Sommelier, 🍷+🍕 ci sta
•
🕹 Founder Gameplay.Café, 16 anni di https://t.co/LdSwubE6QA
•
🇮🇹🇬🇧🇯🇵","Italy, Japan",691,11562,58032,2008-02-08 09:39:34,2020-06-11 23:39:59,0,"@ilory05 alla grande, mi svolti il periodo di covid pessimo :D",[],,,
1271225614712950784,Herbert403,,,677,4430,160454,2013-02-10 20:01:12,2020-06-11 23:39:39,83,Nemmeno il sindaco della città più colpita al mondo (fonte @nytimes) riesce ad avere i dati da @RegLombardia. Come si può gestire la sorveglianza in questo modo? Poi criticano i cinesi! La TRASPARENZA è essenziale per contrastare #COVID https://t.co/zIpIzNJpwt,[],,,
1271225593011601408,flaviotiravento,😇,,440,277,36721,2016-09-05 23:24:57,2020-06-11 23:39:34,292,"Comunque ho parlato con un amico in Cina, ha detto che è meglio non prendere il COVID-19 perché a Settembre esce il 20... Con più funzioni.",[],,,
1271225586833330181,Infinity_999,"Sono un avvocato. Mi piacciono la musica, i films, le scienze in generale. Sono un fan di Zelda. Odio le censure e chi le impone. Information wants to be free.",Hyrule Field,560,1784,118936,2010-05-20 22:00:55,2020-06-11 23:39:32,0,"@artiscenichecom @RaiDue Ho capito.
Ma puntano il dito solo su quello.
NON si parla del Covid, dell'epidemia, di come si è doffusa, di come è stata gestita.
Si parla solo del terrore, dell'angoscia e cose simili.
Non è storia. Sono solo storie.
C'è differenza.",[],,,
1271225561164046337,abnguy2020,🇺🇸😎,"California, USA",91,37,1556,2020-04-06 02:28:33,2020-06-11 23:39:26,890,"#Covid_19, per mettere fine alla propaganda di regime #Bolsonaro manda la polizia per controllare le sepolture,,,, e guardate cosa scoprono!!!
#ArrestateliTutti https://t.co/N6y1rHAxTl","[{'text': 'Covid_19', 'indices': [19, 28]}, {'text': 'Bolsonaro', 'indices': [73, 83]}]",,,
1271225531988619264,OliveiraGab2,Nada de bom,SSP,306,116,2467,2016-02-07 03:39:15,2020-06-11 23:39:19,0,@pamcomentss @felipeprior Maldito covid adiando essa foto,[],,,
1271225510908092419,Herbert403,,,677,4430,160454,2013-02-10 20:01:12,2020-06-11 23:39:14,1613,"Leggo che in #Lombardia ieri ci sono stati 32 decessi per #Covid. Non si sa però dove, in quale provincia, perché la Regione non comunica + i dati divisi.
Da quando abbiamo segnalato che i decessi reali erano molti di + di quelli “ufficiali”, hanno secretato i dati per provincia.","[{'text': 'Lombardia', 'indices': [31, 41]}, {'text': 'Covid', 'indices': [76, 82]}]",,,
1271225413277114368,MAGAChronicle,,,9423,12083,177015,2009-03-29 01:46:13,2020-06-11 23:38:51,890,"#Covid_19, per mettere fine alla propaganda di regime #Bolsonaro manda la polizia per controllare le sepolture,,,, e guardate cosa scoprono!!!
#ArrestateliTutti https://t.co/N6y1rHAxTl","[{'text': 'Covid_19', 'indices': [19, 28]}, {'text': 'Bolsonaro', 'indices': [73, 83]}]",,,
1271225380549033991,frijoles12,"Q,WWG1WGA,KAG2020 Culinary,Entremeiter, USS Ogden LPD-5,Amphib-NavyVet,
WhiteHat,EagleScout,LEOsupporter, Cats,🕎YHWH✝Yeshua🛐Israel🇮🇱Jerusalem✡+לוחם קדוש", Oklahoma,11337,10302,63420,2013-11-01 05:13:55,2020-06-11 23:38:43,890,"#Covid_19, per mettere fine alla propaganda di regime #Bolsonaro manda la polizia per controllare le sepolture,,,, e guardate cosa scoprono!!!
#ArrestateliTutti https://t.co/N6y1rHAxTl","[{'text': 'Covid_19', 'indices': [19, 28]}, {'text': 'Bolsonaro', 'indices': [73, 83]}]",,,
1271225185681780736,saryxs87,,,118,328,17869,2014-12-13 15:09:26,2020-06-11 23:37:57,126,"In Germania si chiedono se il COVID fosse una vera pandemia o solo una brutta influenza derivante da uno dei tanti virus. Sono morte 250 mila persone di COVID contro  1.500.000  di influenza degli anni precedenti. Valeva la pena bloccare l'economia? 
https://t.co/a6p2Np9mM1",[],,,
1271225034112217088,startzai,smart finance for smart communities - #equitycrowdfunding #EU. Contacts: @maurostampatori,italy,306,3834,149721,2013-04-24 18:28:50,2020-06-11 23:37:21,6,Startup americane e Covid-19: ecco chi ha licenziato durante la pandemia nel post odierno di @startupmag17 di @fraasco85! #StartUpMag #Digital #Startup #Startups #SiliconValley https://t.co/lbSi92MjJU,[],,,
1271224902331367425,startzai,smart finance for smart communities - #equitycrowdfunding #EU. Contacts: @maurostampatori,italy,306,3834,149721,2013-04-24 18:28:50,2020-06-11 23:36:49,6,Startup americane e Covid-19: ecco chi ha licenziato durante la pandemia nel post odierno di @startupmag17 di @fraasco85! #StartUpMag #Digital #Startup #Startups #SiliconValley https://t.co/QGqQMWVXur,[],,,
1271224840423440387,startzai,smart finance for smart communities - #equitycrowdfunding #EU. Contacts: @maurostampatori,italy,306,3834,149721,2013-04-24 18:28:50,2020-06-11 23:36:34,6,Startup americane e Covid-19: ecco chi ha licenziato durante la pandemia nel post odierno di @startupmag17 di @fraasco85! #StartUpMag #Digital #Startup #Startups #SiliconValley https://t.co/xi1tobcLih,[],,,
1271224698421096453,ombremosse,mediaosmosi ibrida,sintesi digitale,851,383,2789,2007-08-09 07:30:13,2020-06-11 23:36:00,18,"Una classe di 29 bambini. Di 6 anni.
In era Covid.
Da organizzare non si sa come e con quali docenti.
Siamo un Paese allucinante. In cui “appartare le carte”, non le persone e i bisogni, è diventata la prima legge suprema. https://t.co/xrR7504QJd",[],,,
1271224659795722240,lbraunli,Mom. Wife. Artist. *Stay engaged*,"Bucks County, PA",2189,1259,133261,2012-02-14 23:32:42,2020-06-11 23:35:51,8,Cognitive dissonance. https://t.co/5r9eOSmqEp,[],,,
1271224628682383362,startzai,smart finance for smart communities - #equitycrowdfunding #EU. Contacts: @maurostampatori,italy,306,3834,149721,2013-04-24 18:28:50,2020-06-11 23:35:44,6,Startup americane e Covid-19: ecco chi ha licenziato durante la pandemia nel post odierno di Start Up Mag di @fraasco85! #StartUpMag #Digital #Startup #Startups #SiliconValley https://t.co/Cs8zklNFBS,[],,,
1271224548315353089,HouGibson,Writer & Researcher,"Houston, TX",222,213,4448,2013-10-31 17:13:06,2020-06-11 23:35:25,890,"#Covid_19, per mettere fine alla propaganda di regime #Bolsonaro manda la polizia per controllare le sepolture,,,, e guardate cosa scoprono!!!
#ArrestateliTutti https://t.co/N6y1rHAxTl","[{'text': 'Covid_19', 'indices': [19, 28]}, {'text': 'Bolsonaro', 'indices': [73, 83]}]",,,
1271224481214861313,ilgrilloparlan2,"Bibliotecario collezioni orologi amo viaggiare.Odio il conformism travestito da trasgressione, l’ipocrisia di accusare gli altri, mentre si fanno le stesse cose",Italia,161,202,29213,2016-10-27 22:10:55,2020-06-11 23:35:09,43,"#Pandemia, si teme la seconda ondata #Covid, gli esperti invitano a prepararsi. Il virologo #Usa #Fauci: 'Per almeno un anno non sarà possibile tornare alla normalità'. #ANSA #COVID-19
https://t.co/mCAY9p8QwU","[{'text': 'Pandemia', 'indices': [18, 27]}, {'text': 'Covid', 'indices': [55, 61]}, {'text': 'Usa', 'indices': [110, 114]}, {'text': 'Fauci', 'indices': [115, 121]}]",,,
1271224475372191746,startzai,smart finance for smart communities - #equitycrowdfunding #EU. Contacts: @maurostampatori,italy,306,3834,149721,2013-04-24 18:28:50,2020-06-11 23:35:07,6,Startup americane e Covid-19: ecco chi ha licenziato durante la pandemia nel post odierno di @startupmag17! #StartUpMag #Digital #Startup #Startups #SiliconValley https://t.co/bsgnicISui,"[{'text': 'StartUpMag', 'indices': [123, 134]}]",,,
1271224416484106241,ShogunMito,🇮🇹,,71,75,4881,2018-05-31 15:21:39,2020-06-11 23:34:53,0,"@claudiomontar @AlbertoLetizia2 @AdrianaSpappa @jacopo_iacoboni tutte le misure in relazione al COVID rientrano nella profilassi internazionale. Il tar Calabria, ha bloccato la fuga in avanti della Regione sulle riaperture, facendo riferimento proprio all'art. 117 comma 2 lettera q)",[],,,
1271224098367119367,genusmigrans,"""ne tombez pas amoureux du pouvoir""",Roma,628,252,9717,2015-11-15 11:57:14,2020-06-11 23:33:37,1613,"Leggo che in #Lombardia ieri ci sono stati 32 decessi per #Covid. Non si sa però dove, in quale provincia, perché la Regione non comunica + i dati divisi.
Da quando abbiamo segnalato che i decessi reali erano molti di + di quelli “ufficiali”, hanno secretato i dati per provincia.","[{'text': 'Lombardia', 'indices': [31, 41]}, {'text': 'Covid', 'indices': [76, 82]}]",,,
1271224072886611968,fainformazione,"Fainformazione è un social network, rivolto ai blogger italiani, che possono inserire i loro post manualmente o in automatico,  mediante feed RSS o Atom",Italy,0,914,947489,2009-03-15 16:56:47,2020-06-11 23:33:31,0,"Il sindaco di Bergamo: la regione Lombardia non comunica correttamente i dati sui decessi Covid  Il sindaco di Bergamo, Giorgio Gori, giovedì mattina ha inviato una serie di tweet in cui afferma che la Regione Lombardia abbia smesso, da… https://t.co/js489dKUzt",[],,,
1271223996781117441,giovanni_nurra,"Dottore commercialista, cultore di economia aziendale e programmazione e controllo. Pittore e pilota nel tempo libero.
Economista per passione.",,730,336,8173,2012-01-31 17:00:15,2020-06-11 23:33:13,28,Non ho capito quando scatta il “rinchiudiamo tutti”. 15000 morti per influenza non bastano a farci andare in lockdown. Loro evidentemente non contano. Perché qualche morto in più per covid fa cambiare tutto? Qual è il confine in cui si sceglie di non vivere per paura di morire?,[],,,
1271223921350709261,sidewayseye,,Sud,395,323,28438,2013-02-25 21:44:26,2020-06-11 23:32:55,244,"Sindaco @giorgio_gori sono l'autore del pezzo uscito su @24infodata 
Confermo: dopo il nostro pezzo e dopo che @ondatait ha pubblicato i dati @RegLombardia ha chiuso l'accesso ai dati. Ho fatto richieste Foia per averli, non ha risposto.
Qui il pezzo: https://t.co/BmOiVUyzbc https://t.co/rl717RwdGb",[],,,
1271223736776171522,sidewayseye,,Sud,395,323,28438,2013-02-25 21:44:26,2020-06-11 23:32:11,1613,"Leggo che in #Lombardia ieri ci sono stati 32 decessi per #Covid. Non si sa però dove, in quale provincia, perché la Regione non comunica + i dati divisi.
Da quando abbiamo segnalato che i decessi reali erano molti di + di quelli “ufficiali”, hanno secretato i dati per provincia.","[{'text': 'Lombardia', 'indices': [31, 41]}, {'text': 'Covid', 'indices': [76, 82]}]",,,
1271223570165829640,cicuttin_a,,,57,130,12844,2016-07-13 11:18:59,2020-06-11 23:31:31,70,"La #mascherina a #scuola dopo i 6 anni d'età ma prima no?! Perché caso mai il #COVID arrivasse, a 5 anni e 10 mesi si gira e se ne va?! RIDICOLI, LA VERITÀ È CHE LA MASCHERINA SARÀ L'INIZIO DEL VOSTRO ADDESTRAMENTO ALL'OBBEDIENZA FIN DALLA SCUOLA DELL'OBBLIGO.
@RiccardoFortin","[{'text': 'mascherina', 'indices': [21, 32]}, {'text': 'scuola', 'indices': [35, 42]}, {'text': 'COVID', 'indices': [96, 102]}]",,,
1271223406155964416,pinoiaco,,"Torino, Piemonte",584,329,14138,2012-11-28 08:36:21,2020-06-11 23:30:52,0,"#Londra 700 persone morte sole in casa per il #coronavirus, 
Durante il lockdown decine di anziani, disabili e persone fragili sono morte da sole nelle loro abitazioni ritrovate dopo settimane, dimenticati da parenti, amici e dallo Stato. 
#Covid_19

https://t.co/bGiLSeupqr","[{'text': 'Londra', 'indices': [0, 7]}, {'text': 'coronavirus', 'indices': [46, 58]}, {'text': 'Covid_19', 'indices': [240, 249]}]",,,
1271223030778179585,isco2k8,,,128,21,203,2020-04-01 19:27:02,2020-06-11 23:29:23,890,"#Covid_19, per mettere fine alla propaganda di regime #Bolsonaro manda la polizia per controllare le sepolture,,,, e guardate cosa scoprono!!!
#ArrestateliTutti https://t.co/N6y1rHAxTl","[{'text': 'Covid_19', 'indices': [19, 28]}, {'text': 'Bolsonaro', 'indices': [73, 83]}]",,,
1271223009722982401,assodigitale,Assodigitale è la testata editoriale per eccellenza che dal 2004 racconta le tendenze della tecnologia digitale alfabetizzando i lettori italiani e svizzeri CH,lugano - Canton Ticino - CH,160,1850,68405,2009-11-23 14:59:38,2020-06-11 23:29:18,0,Le Startup svizzere della Blockchain colpite dalla crisi covid-19 non verranno abbandonate dalla confederazione https://t.co/8Nmc20cJT9 #breaking #news #update,"[{'text': 'breaking', 'indices': [136, 145]}, {'text': 'news', 'indices': [146, 151]}, {'text': 'update', 'indices': [152, 159]}]",,,
1271222998654226445,paolo_spagnolli,"Non blocco nessuno, a meno che non sia pubblicità o volgare offesa gratuita ....",,1044,365,7305,2013-02-02 20:53:26,2020-06-11 23:29:15,244,"Sindaco @giorgio_gori sono l'autore del pezzo uscito su @24infodata 
Confermo: dopo il nostro pezzo e dopo che @ondatait ha pubblicato i dati @RegLombardia ha chiuso l'accesso ai dati. Ho fatto richieste Foia per averli, non ha risposto.
Qui il pezzo: https://t.co/BmOiVUyzbc https://t.co/rl717RwdGb",[],,,
1271222977984630784,luz_luca_75,“Ho imparato che il problema degli altri è uguale al mio. Sortirne tutti insieme è politica. Sortirne da soli è avarizia.” Don Lorenzo Milani,"Milano, Lombardia",255,54,1543,2018-08-12 01:06:51,2020-06-11 23:29:10,164,"E così per Berlusconi e il suo partito Villa Pamphili va bene per ospitare Gheddafi e le sue amazzoni, ma non per un incontro istituzionale sul rilancio dell’economia italiana dopo la tragedia del covid.

Forza Italia non ha vergogna.

#StatiGeneraliEconomia",[],,,
1271222943608180736,luz_luca_75,“Ho imparato che il problema degli altri è uguale al mio. Sortirne tutti insieme è politica. Sortirne da soli è avarizia.” Don Lorenzo Milani,"Milano, Lombardia",255,54,1543,2018-08-12 01:06:51,2020-06-11 23:29:02,1613,"Leggo che in #Lombardia ieri ci sono stati 32 decessi per #Covid. Non si sa però dove, in quale provincia, perché la Regione non comunica + i dati divisi.
Da quando abbiamo segnalato che i decessi reali erano molti di + di quelli “ufficiali”, hanno secretato i dati per provincia.","[{'text': 'Lombardia', 'indices': [31, 41]}, {'text': 'Covid', 'indices': [76, 82]}]",,,
1271222926809989121,CinqueRighe,Testata registrata al Tribunale di Avellino Editore Pillola Rossa iscritta al R. O. C.; e-mail: redazione@cinquerighe.it LA VERITA' E' IL CUORE DELLA NOTIZIA,"Summonte, Avellino",531,1074,136304,2011-01-11 11:37:10,2020-06-11 23:28:58,0,"ENTI - ASL,COVID 455 tamponi analizzati con nessun positivo -  https://t.co/IZ8wH5Q0Gh via @CinqueRighe",[],,,
1271222723260358659,infoitinterno,Sezione Dall'Interno di informazione.it. Notizie di cronaca e politica relative all'Italia,Italia,4,4284,2362299,2011-06-15 09:00:41,2020-06-11 23:28:10,0,Risalgono i contagi da Covid. Due su tre in Lombardia https://t.co/kNn98I4Sm9,[],,,
1271222660694003714,scastaldi9,"Cogito ergo sum

/ Vanitas vanitatum et omnia vanitas/
No Dm",Firenze (Italy),441,11327,345852,2015-12-22 23:09:45,2020-06-11 23:27:55,10,"@LunaLeso @MaurilioVitto @mariaireneali @BaroneZaza70 @BrindusaB1 @CaterinaCategio @_Vivi2013 @EnricoCastrovil @user9870 @scastaldi9 @GuernseyJuliet @VAlivernini @redne2013 Quando tornerà il Sole potremo godere di splendi  crepuscoli, mano nella mano, Covid permettendo! Grazie Luna per il magnifico regalo che ricambio ...!🤗😘🌟💓🙋‍♂️

Maxfield Parish
Crepuscolo, 1935 https://t.co/E38n2Cfpdq",[],,,
1271222529760399362,jeananimal,"No Direct Messages please. Married to Brian for 30 years, Conservative, dog lover, 3 adult children.",,2157,1459,41269,2013-04-09 00:32:02,2020-06-11 23:27:23,890,"#Covid_19, per mettere fine alla propaganda di regime #Bolsonaro manda la polizia per controllare le sepolture,,,, e guardate cosa scoprono!!!
#ArrestateliTutti https://t.co/N6y1rHAxTl","[{'text': 'Covid_19', 'indices': [19, 28]}, {'text': 'Bolsonaro', 'indices': [73, 83]}]",,,
1271222510957273089,Itinara,"Amo sorridere e riflettere. Non sopporto l'ipocrisia e quando sbaglio chiedo scusa, provando a rimediare. Ma quando piango cerco di farlo nel segreto del cuore.",Italia,555,906,61208,2011-02-14 15:00:31,2020-06-11 23:27:19,0,"Là vogliono arrivare, tra le altre cose a cui serve il covid!!! https://t.co/HaEAEyfUFU",[],,,
1271222508960854026,MIorino,,,127,73,2869,2011-11-26 16:55:28,2020-06-11 23:27:18,292,"Comunque ho parlato con un amico in Cina, ha detto che è meglio non prendere il COVID-19 perché a Settembre esce il 20... Con più funzioni.",[],,,
1271222477012832257,MegghieUP,,Pisa,822,248,24426,2012-03-26 17:18:40,2020-06-11 23:27:11,21,La proibizione dei popcorn al cinema dovrebbe essere estesa anche una volta finita l'emergenza Covid.,[],,,
1271222444544733186,zazoomblog,Zazoom Social News ... Tutte le notizie dalle migliori fonti del web! Segnala il tuo Blog. Zazoom Social News è un un'idea che aiuta a dar voce al tuo sito!,Italia,1556,5430,3026977,2010-12-29 08:42:05,2020-06-11 23:27:03,0,Che Dio ci aiuti 6- Anticipazioni Elena Sofia Ricci: Covid? Sul set tamponi e test -  #aiuti #Anticipazioni #Elena #Sofia  https://t.co/qYRssxFAfO,"[{'text': 'aiuti', 'indices': [86, 92]}, {'text': 'Anticipazioni', 'indices': [93, 107]}, {'text': 'Elena', 'indices': [108, 114]}, {'text': 'Sofia', 'indices': [115, 121]}]",,,
1271222376240472064,luisa_chiari,lega pd forza Italia fratelli d’ndrangheta  =💩,,1005,628,57476,2019-07-18 05:10:50,2020-06-11 23:26:47,13,"La #Destra ha deciso di non partecipare agli stati generali convocati da @GiuseppeConteIT per riavviare l'Italia dopo il Covid 19. Non mi sembra un comportamento responsabile, specialmente dopo essersi lamentati di non essere ascoltati nelle loro proposte","[{'text': 'Destra', 'indices': [20, 27]}]",,,
1271222235932569603,995AdAlessandro,Vis Substantiae Vis Ingenii Vis Naturae,,39,16,5913,2014-06-29 08:51:45,2020-06-11 23:26:13,0,"Le istituzioni internazionali prendano una posizione dura ed univoca verso i paesi con gestione eufemisticamente allegra del covid. 
Brasile in primis.",[],,,
1271222189568585729,sachibuuuu,3児の母です。最近Twitterを活用し始めたばかりです。,日本　愛知,405,196,15991,2018-08-28 07:26:17,2020-06-11 23:26:02,890,"#Covid_19, per mettere fine alla propaganda di regime #Bolsonaro manda la polizia per controllare le sepolture,,,, e guardate cosa scoprono!!!
#ArrestateliTutti https://t.co/N6y1rHAxTl","[{'text': 'Covid_19', 'indices': [19, 28]}, {'text': 'Bolsonaro', 'indices': [73, 83]}]",,,
1271222167376723970,CastigliMirella,"#Giornalista, #IamEuropean. Blog: https://t.co/QE9f6B9vQy; https://t.co/iHAOr1BYRd . Books: Mela marcia, Zero Privacy, Nativi digitali a scuola.", #iorestoacasa,801,840,29319,2012-01-31 11:07:03,2020-06-11 23:25:57,244,"Sindaco @giorgio_gori sono l'autore del pezzo uscito su @24infodata 
Confermo: dopo il nostro pezzo e dopo che @ondatait ha pubblicato i dati @RegLombardia ha chiuso l'accesso ai dati. Ho fatto richieste Foia per averli, non ha risposto.
Qui il pezzo: https://t.co/BmOiVUyzbc https://t.co/rl717RwdGb",[],,,
1271222152868569089,75libero,no foto,,163,35,1964,2013-06-07 18:39:25,2020-06-11 23:25:54,13,"La #Destra ha deciso di non partecipare agli stati generali convocati da @GiuseppeConteIT per riavviare l'Italia dopo il Covid 19. Non mi sembra un comportamento responsabile, specialmente dopo essersi lamentati di non essere ascoltati nelle loro proposte","[{'text': 'Destra', 'indices': [20, 27]}]",,,
1271222141279764491,alberto_parini,"Considerate la vostra semenza: 
fatti non foste a viver come bruti
ma per seguir virtute e canoscenza",,560,279,54227,2015-09-16 16:03:27,2020-06-11 23:25:51,66,"Il @Corriere:""i dati falsi dei paesi autoritari sul Covid."" Il governo prima ha terrorizzato l'Italia e poi ha detto che non sa se i 33mila morti sono deceduti per Covid. E il Corriere osa chiamare il Brasile autoritario. Il vero regime è il governo PD-M5S
https://t.co/Qbh9hJt3L1",[],,,
1271221977181614082,LucaFilippi5,Giornalista La Nazione                                               Se credete che questo mondo sia brutto è  perché  non avete visto gli altri,,1151,672,10287,2012-10-11 18:50:45,2020-06-11 23:25:12,8,"#Brexit, industriali GB: sistema non reggerebbe Covid e 'no-deal' https://t.co/TYsDBDtInU","[{'text': 'Brexit', 'indices': [11, 18]}]",,,
1271221961914486789,CdiCorposalud,,,60,34,1227,2020-05-19 12:23:46,2020-06-11 23:25:08,12,"CDI Corito listo para continuar la batalla contra la COVID-19. #CubaEsSalud #CubaCoopera #CubaSalvaVidas #VamosPorMas #BarrioAdentro17Aniversario 
#OrgullosoDeSercubano
@RomanAguiar1
@Yordank68681193
@cubacooperaveZ1
@UjcZul https://t.co/hAztXuWFmE","[{'text': 'CubaEsSalud', 'indices': [84, 96]}, {'text': 'CubaCoopera', 'indices': [97, 109]}, {'text': 'CubaSalvaVidas', 'indices': [110, 125]}, {'text': 'VamosPorMas', 'indices': [126, 138]}]",,,
1271221919501729792,SorrentClaudia,"il piu grande nemico della conoscenza non e' l'ignoranza, ma l'illusione di sapere ( S. Hawking) Il presente è sviluppo possibile verso il futuro che vogliamo",,782,773,31995,2013-03-24 12:26:55,2020-06-11 23:24:58,258,"Dopodiché dite voi se è normale che questi dati non vengano normalmente comunicati, e se ancora oggi i sindaci lombardi siano del tutto all’oscuro sul numero dei positivi #Covid dei loro comuni.",[],,,
1271221899582820352,BughiTamtam,"Live like a cat, love like a dog.",,171,130,30368,2019-11-24 17:09:06,2020-06-11 23:24:53,141,"Il #Covid ha insegnato che: i virologi sono marchettari inaffidabili, la medicina funziona solo se non segue i protocolli, i modelli matematici non servono a una minchia, l’Oms è credibile come il Mago Otelma. E lascienzah ha rotto veramente il cazzo","[{'text': 'Covid', 'indices': [15, 21]}]",,,
1271221816426725377,IdeeXscrittori,"Sono l'Ideota, un mostro. Pinterest https://t.co/rtuwxKWotT Instagram https://t.co/1XqcP1bq2M Tumblr https://t.co/hdxTMm5Ggq",,197,56922,62146,2010-06-29 14:00:50,2020-06-11 23:24:33,21,La proibizione dei popcorn al cinema dovrebbe essere estesa anche una volta finita l'emergenza Covid.,[],,,
1271221601405743104,Fortunablu17,,,401,365,7663,2020-03-18 18:35:55,2020-06-11 23:23:42,103,Il partito della #Meloni protesta nelle Marche per il Covid center realizzato alla fiera di Civitanova da #Bertolaso. In #Lombardia dove governano con #Fontana e #Gallera invece l’identico Covid center alla Fiera di Milano va benone. Quanta coerenza! https://t.co/poNiTPULN8,"[{'text': 'Meloni', 'indices': [36, 43]}, {'text': 'Bertolaso', 'indices': [125, 135]}]",,,
1271221557017403393,HorsesLidia,Semplice e allegra adoro gli animali e la natura.,"Novafeltria, Emilia Romagna",28,8,48,2020-05-15 06:52:12,2020-06-11 23:23:32,141,"Il #Covid ha insegnato che: i virologi sono marchettari inaffidabili, la medicina funziona solo se non segue i protocolli, i modelli matematici non servono a una minchia, l’Oms è credibile come il Mago Otelma. E lascienzah ha rotto veramente il cazzo","[{'text': 'Covid', 'indices': [15, 21]}]",,,
1271221372698550273,clauvolleyball1,,,202,69,89926,2016-06-19 17:57:59,2020-06-11 23:22:48,8,Cognitive dissonance. https://t.co/5r9eOSmqEp,[],,,
1271221267635544071,Stevedark79,"Chi rinuncia alla libertà per raggiungere la sicurezza, non merita né la libertà né la sicurezza. (Benjamin Franklin)",,534,232,5592,2011-12-12 23:44:55,2020-06-11 23:22:23,0,"@AlessioBoni_FP Se ci faranno un film farai il doppiatore. Se ci sarà ancora un mondo dove girare film! Cmq per la cronaca George era un pluricondannato, tossico e positivo al covid. Dovremmo inginocchiarci tutti per le vittime di droga che sto tizio a ucciso. #iononmiinginocchio","[{'text': 'iononmiinginocchio', 'indices': [261, 280]}]",,,
1271221258483634176,CinqueRighe,Testata registrata al Tribunale di Avellino Editore Pillola Rossa iscritta al R. O. C.; e-mail: redazione@cinquerighe.it LA VERITA' E' IL CUORE DELLA NOTIZIA,"Summonte, Avellino",531,1074,136304,2011-01-11 11:37:10,2020-06-11 23:22:20,0,"ENTI - Regione, COVID Un  tampone positivo su 3.998 -  https://t.co/yzrLSf6WYD via @CinqueRighe",[],,,
1271221206927249410,neverajoey,"The show must go on, all over the place, or something.","London, England",446,2327,186725,2009-08-29 15:35:28,2020-06-11 23:22:08,0,Non so voi ma sto cazzo di lockdown e covid mi hanno fottuto l’esistenza nel giro di pochi mesi,[],,,"Ealing, London"
1271221176719851537,zazoomblog,Zazoom Social News ... Tutte le notizie dalle migliori fonti del web! Segnala il tuo Blog. Zazoom Social News è un un'idea che aiuta a dar voce al tuo sito!,Italia,1556,5430,3026977,2010-12-29 08:42:05,2020-06-11 23:22:01,0,Zaia De Luca e Bonaccini governatori più apprezzati per gestione Covid -  #Bonaccini #governatori #apprezzati  https://t.co/6oKMBtFGfL,"[{'text': 'Bonaccini', 'indices': [74, 84]}, {'text': 'governatori', 'indices': [85, 97]}, {'text': 'apprezzati', 'indices': [98, 109]}]",,,
