id,username,acctdesc,userlocation,following,followers,totaltweets,usercreatedts,tweetcreatedts,retweetcount,text,hashtags,lat,lon,placeName
1271290010868699142,PaolaSimonin,,,2551,1945,64809,2016-06-26 21:48:14,2020-06-12 03:55:32,98,"Se tutte le morti vengono registrate come covid e tutte le compagnie assicurative non risarciscono causa pandemia? Immaginatevi chi ha fatto l'assicurazione sulla vita o sulla salute e poi viene registrato come morte di covid... tutti gabbati!
Una truffa globale schifosa!!!!",[],,,
1271289948046422017,SimonaeSto,"Good intentions, bad results..
 Invisible for someone",Roma,646,805,21514,2011-08-06 13:39:23,2020-06-12 03:55:17,0,"Covid, c'è un gruppo sanguigno che rischia di meno il contagio: sangue di tipo 0 https://t.co/CWNHWsVwUu @leggoit",[],,,
1271289795033960450,AndreaSpagnol15,,,102,27,1685,2019-11-01 10:08:56,2020-06-12 03:54:41,0,@ColpogobboYtube Non lo so se ascolti Sky sport ripetono in continuazione che il Covid ha pareggiato gli equilibri e che in una partita come Juve Milan i giocatori di talento non faranno la differenza 🤷🏻‍♂️ boh...stasera vediamo,[],,,
1271289745658662914,galata_mf,,,482,331,54356,2014-02-08 22:45:43,2020-06-12 03:54:29,55,"Si, faremo i Pronto Soccorso dedicati al Covid 19. Chi arriva per un infarto dovrà andare in quelli sovraffollati a causa dei vostri tagli. Ma perché non mettiamo anche le giostrine per i bambini con distributori di popcorn? Visto che lavori così bene con la fantasia?
#Mes https://t.co/B6DNACqt5X",[],,,
1271289634106994688,ilSaronno,Tutta Saronno online. Tutti i giorni.,,150,1273,42986,2012-11-06 19:47:17,2020-06-12 03:54:02,0,"Le notizie di giovedì: assembramenti, chiuso il parco del Matteotti. A Caronno 2 nuovi casi covid. Minacce di morte a Dante https://t.co/N76yzkTBYH",[],,,
1271289550229266433,romanino48,"Dottore Commercialista - Revisore Legale
Non aspettare che il vento gonfi la vela della tua fortuna. Soffiaci dentro te. (Ugo Ojetti)",Roma,4994,2999,39206,2013-01-05 15:42:53,2020-06-12 03:53:42,12,"L' INPS per rilasciare il DURC regolare, vuole avere il pagamento del mese di Marzo,Aprile e Maggio.
Ma se c'è stata l'emergenza Covid-19, come fa un'impresa a regolarizzare il tutto senza liquidità essendo rimasta chiusa?
Governo inadeguato e ridicolo.
#DrittoeRovescio",[],,,
1271289323757858821,KoryCed09,"poblana, soñadora, comunicóloga, aventurera 😎💅",México,287,111,292,2010-06-25 22:43:25,2020-06-12 03:52:48,0,Triste e indignante. #Covid_19mx https://t.co/I0en7nNpuW,"[{'text': 'Covid_19mx', 'indices': [21, 32]}]",,,
1271289319097958405,infoitinterno,Sezione Dall'Interno di informazione.it. Notizie di cronaca e politica relative all'Italia,Italia,4,4284,2362299,2011-06-15 09:00:41,2020-06-12 03:52:47,0,"Covid, caso a Guardea e due guarigioni. Montecastrilli 'free' https://t.co/E7zedbUmYo",[],,,
1271289255159975938,giu0112,,,228,6,1809,2019-11-26 06:27:07,2020-06-12 03:52:32,21,La proibizione dei popcorn al cinema dovrebbe essere estesa anche una volta finita l'emergenza Covid.,[],,,
1271289210905915394,pastore_arturo,,,253,85,4130,2015-05-30 07:41:46,2020-06-12 03:52:21,0,La Corte dei Conti apre un terzo fascicolo sull’intesa tra la giunta umbra scelta da Salvini e le cliniche private per curare i pazienti no-Covid – Perugia Notizie | https://t.co/dH6u8Hn3x8 Notizie https://t.co/kCxsAZuarf,[],,,
1271289136318574595,Amaro57024721,Pensante. Moderatamente stronzo.Visceralmente antifascista antileghista e disgustato dal M5S. Ma non mi arrendo.,,3692,2219,219537,2016-08-11 11:13:09,2020-06-12 03:52:04,3,"Lombardia - A Milano e Lodi morti 5.500 over 70 in più della media.
Maledetto Covid e un grazie a Formigoni, Fontana e Gallera.",[],,,
1271289130077450244,zazoomblog,Zazoom Social News ... Tutte le notizie dalle migliori fonti del web! Segnala il tuo Blog. Zazoom Social News è un un'idea che aiuta a dar voce al tuo sito!,Italia,1556,5430,3026977,2010-12-29 08:42:05,2020-06-12 03:52:02,0,Zaia De Luca e Bonaccini governatori più apprezzati per gestione Covid -  #Bonaccini #governatori #apprezzati  https://t.co/nF68rKh77d,"[{'text': 'Bonaccini', 'indices': [74, 84]}, {'text': 'governatori', 'indices': [85, 97]}, {'text': 'apprezzati', 'indices': [98, 109]}]",,,
1271289088130220033,AlbaGiunzioni,"pensionata, nonna, amante della campagna e delle tradizioni. Interessata a quel che succede nel mondo.",Macognano ( Modena),370,316,17802,2012-05-10 07:21:42,2020-06-12 03:51:52,188,fatemi capire.... il vaccino per gli over  60 non garantisce  che non ti ammalerai di COVID ..dà una possibilità di copertura fino al 35%!!!  dovremmo vaccinarci senza neanche  la garanzia di una copertura'? ma anche  no  grazie!!!  così oggi il Prof  Locatelli ad #Agora,[],,,
1271289016294363139,MauriWLJ,"""Haec est ora vestra et potestas tenebrarum""",,185,225,35519,2012-12-17 18:21:02,2020-06-12 03:51:35,292,"Comunque ho parlato con un amico in Cina, ha detto che è meglio non prendere il COVID-19 perché a Settembre esce il 20... Con più funzioni.",[],,,
1271288695090372608,dcicino,,,69,31,27,2012-02-15 21:25:57,2020-06-12 03:50:18,1039,L'italia è quel paese in cui sono morte 34mila persone di covid e i sondaggi danno il 26% a un tizio che ritiene giusto togliersi la mascherina mentre parla o si fa un selfie appiccicato a qualcun altro.,[],,,
1271288605835538432,chance993,最近は情報収集にいそしんでいます。良い世界になってほしい。気軽にからんでください！,,2055,1370,9338,2010-01-17 04:01:19,2020-06-12 03:49:57,890,"#Covid_19, per mettere fine alla propaganda di regime #Bolsonaro manda la polizia per controllare le sepolture,,,, e guardate cosa scoprono!!!
#ArrestateliTutti https://t.co/N6y1rHAxTl","[{'text': 'Covid_19', 'indices': [19, 28]}, {'text': 'Bolsonaro', 'indices': [73, 83]}]",,,
1271288503314165762,JJDippold,path ranger & council development advocate | new dimensions of the ever beyond | synchrohumor | remembering awareness | don’t disbelieve/believe — research it,RealityDoesNotExistOn-Screen,70,275,9454,2008-07-14 18:41:47,2020-06-12 03:49:33,890,"#Covid_19, per mettere fine alla propaganda di regime #Bolsonaro manda la polizia per controllare le sepolture,,,, e guardate cosa scoprono!!!
#ArrestateliTutti https://t.co/N6y1rHAxTl","[{'text': 'Covid_19', 'indices': [19, 28]}, {'text': 'Bolsonaro', 'indices': [73, 83]}]",,,
1271288488613130241,luciano9121967,,,431,31,680,2016-12-01 19:53:25,2020-06-12 03:49:29,0,"@giorgio_gori Qui è stato secretato tutto persino il fatto che il covid non esiste,ma esiste un virus influenzale ad alta carica virale che può essere letale alle persone più deboli con due o più patologie pregresse e che si muore per le manovre da intubazione #tromboemboliapolmonare.","[{'text': 'tromboemboliapolmonare', 'indices': [261, 284]}]",,,"Mondolfo, Marche"
1271288323059810304,piras_zia,,,381,827,218875,2013-01-27 13:53:57,2020-06-12 03:48:50,32,"""Il reddito di cittadinanza non mi pare che abbia prodotto dei grandi risultati. Il #covid si è aggiunto ad una situazione già poco efficiente""

@BelpietroTweet a #Drittoerovescio https://t.co/hbg07Bkm9N","[{'text': 'covid', 'indices': [105, 111]}]",,,
1271288030716809217,infoitinterno,Sezione Dall'Interno di informazione.it. Notizie di cronaca e politica relative all'Italia,Italia,4,4284,2362299,2011-06-15 09:00:41,2020-06-12 03:47:40,0,Paparelli: «Paziente Covid da Città di Castello a Terni per un femore rotto: si vuole bloccare l'attività dell'ospedale» https://t.co/NPd9NxqAQh,[],,,
1271288029903073280,infoitinterno,Sezione Dall'Interno di informazione.it. Notizie di cronaca e politica relative all'Italia,Italia,4,4284,2362299,2011-06-15 09:00:41,2020-06-12 03:47:40,0,"Effetto covid-19, in provincia di Varese produzione in picchiata - VerbanoNews https://t.co/I9KKN1befy",[],,,
1271287985888059392,ErnestHemming12,I'm a Patriot,,126,66,2991,2019-08-02 18:44:11,2020-06-12 03:47:29,890,"#Covid_19, per mettere fine alla propaganda di regime #Bolsonaro manda la polizia per controllare le sepolture,,,, e guardate cosa scoprono!!!
#ArrestateliTutti https://t.co/N6y1rHAxTl","[{'text': 'Covid_19', 'indices': [19, 28]}, {'text': 'Bolsonaro', 'indices': [73, 83]}]",,,
1271287949749936128,kanokonok099,理想と現実のギャップがすごい オタク,,156,72,4678,2013-03-22 07:20:42,2020-06-12 03:47:21,890,"#Covid_19, per mettere fine alla propaganda di regime #Bolsonaro manda la polizia per controllare le sepolture,,,, e guardate cosa scoprono!!!
#ArrestateliTutti https://t.co/N6y1rHAxTl","[{'text': 'Covid_19', 'indices': [19, 28]}, {'text': 'Bolsonaro', 'indices': [73, 83]}]",,,
1271287867524804608,zazoomblog,Zazoom Social News ... Tutte le notizie dalle migliori fonti del web! Segnala il tuo Blog. Zazoom Social News è un un'idea che aiuta a dar voce al tuo sito!,Italia,1556,5430,3026977,2010-12-29 08:42:05,2020-06-12 03:47:01,0,Sanificazione auto spunta la tassa Covid «Pratica illegale segnalate certi episodi» -  #Sanificazione #spunta #tassa #Covid  https://t.co/M69ZIhceDA,"[{'text': 'Sanificazione', 'indices': [87, 101]}, {'text': 'spunta', 'indices': [102, 109]}, {'text': 'tassa', 'indices': [110, 116]}, {'text': 'Covid', 'indices': [117, 123]}]",,,
1271287607477940224,Cuore_66,,Monza Brianza,4091,4105,3982,2015-11-14 09:08:42,2020-06-12 03:45:59,64,"Chiedo scusa ad #AldoMoro, ma mi piacerebbe farvi cogliere le differenze tra i 2. Le comparazioni dirette a volte servono per svegliare coscienze anestetizzate. Cosa ne pensate? #terrorismo #brigaterosse #Salvini #9maggio #PeppinoImpastato #9maggio1978 #coronavirus #Conte #COVID https://t.co/wBv8XhQ3Et","[{'text': 'AldoMoro', 'indices': [35, 44]}]",,,
1271287518986559488,EdiGirolami,,,2143,1997,58174,2012-12-26 22:40:53,2020-06-12 03:45:38,258,"Dopodiché dite voi se è normale che questi dati non vengano normalmente comunicati, e se ancora oggi i sindaci lombardi siano del tutto all’oscuro sul numero dei positivi #Covid dei loro comuni.",[],,,
1271287122331267072,AleBorzi1981,,,252,186,3045,2017-02-22 13:45:22,2020-06-12 03:44:03,35,"Frasi memorabili dell’#OMS:
- il #Covid è solo epidemia -&gt; pandemia.
- #mascherine inutili -&gt; imprescindibili
- #tamponi solo ai sintomatici -&gt; a tutti
- #guanti fondamentali -&gt; dannosi
- #asintomatici trasmettono il virus -&gt; molto raro

E #Trump taglia giustamente i fondi.","[{'text': 'OMS', 'indices': [36, 40]}, {'text': 'Covid', 'indices': [47, 53]}, {'text': 'mascherine', 'indices': [88, 99]}, {'text': 'tamponi', 'indices': [132, 140]}]",,,
1271286866659033088,BrunaGandolfi4,Antifascista da sempre ❤️ facciamorete sardine,"Milano, Lombardia",176,97,479,2020-02-26 23:13:59,2020-06-12 03:43:03,1,@Marco_dreams Purtroppo il covid-19 si è verificato ben poca cosa contro la corruzione e contro chi con la politica si arricchisce per generazioni.O comprendiamo che scegliere chi ci deve governare è un impegno serio  o siamo condannati a registrare ruberie in continuazione...,[],,,
1271286853136605185,AleBorzi1981,,,252,186,3045,2017-02-22 13:45:22,2020-06-12 03:42:59,385,"Studio #Harvard: ospedali a #Wuhan affollati già ad agosto. Rilevato picco delle auto e boom di ricerche sul web sui sintomi del #Covid. La #Copasir che dice? Ricordiamo le parole di #LucaParmitano: ""Nello spazio sapevo del #Covid19 da novembre."" Processare #Conte. #RadioSavana","[{'text': 'Harvard', 'indices': [24, 32]}, {'text': 'Wuhan', 'indices': [45, 51]}]",,,
1271286725768142848,infoitscienza,"Sezione scienza di informazione.it. Tutte le notizie su tecnologia, scienza, ambiente",Italia,0,534,1022724,2011-06-15 10:22:24,2020-06-12 03:42:29,0,"Siracusa. Più decessi ad Aprile: ""Non il Covid ma forse la paura di andare in ospedale"" https://t.co/h8cSkV0YYV",[],,,
1271286710685429767,infoitsalute,"Sezione salute di informazione.it. Le notizie su salute, medicina, cure",Italia,0,922,523987,2011-06-15 12:09:42,2020-06-12 03:42:25,0,Covid e gruppo sanguigno: davvero chi ha lo 0 rischia meno? https://t.co/15xEpwgaSe,[],,,
1271286694084358144,cristina_lev,...Mamma per sempre...,,114,107,11134,2013-01-21 18:50:43,2020-06-12 03:42:21,141,"Il #Covid ha insegnato che: i virologi sono marchettari inaffidabili, la medicina funziona solo se non segue i protocolli, i modelli matematici non servono a una minchia, l’Oms è credibile come il Mago Otelma. E lascienzah ha rotto veramente il cazzo","[{'text': 'Covid', 'indices': [15, 21]}]",,,
1271286674157211650,guu399,"Pensieri, parole, senza omissioni. Per vostra culpa. Vostra culpa. Vostra grandissima culpa .....ITALY........ITALIAN ... MAI DI SINISTRA 🇮🇹NO ISLAM","Emilia Romagna, Italia",260,465,57372,2011-10-28 23:58:55,2020-06-12 03:42:17,7,"Stati Generali, Conte assicura un piano per tornare a correre https://t.co/wZejrayfRF @Tizzy44196287 @Diabolikart @AdryWebber @mariogiordano5 @Davide38296157 TORNARE A CORRERE MA SE ITALIA ERA IN REGRESSIONE GIÀ PRIMA DEL COVID..CI TRASFORMANO IN VENEZUELA DUE!CI STANNO VENDENDO!",[],,,
1271286660685127684,SilviaaOrtolani,"Counselor e coach PNL. PhD vero. Pragmatica e umanista. Dopo 50 anni a Roma, ora a Milano e Roma.",Roma-Milano,1664,897,24944,2012-09-24 13:55:02,2020-06-12 03:42:13,244,"Sindaco @giorgio_gori sono l'autore del pezzo uscito su @24infodata 
Confermo: dopo il nostro pezzo e dopo che @ondatait ha pubblicato i dati @RegLombardia ha chiuso l'accesso ai dati. Ho fatto richieste Foia per averli, non ha risposto.
Qui il pezzo: https://t.co/BmOiVUyzbc https://t.co/rl717RwdGb",[],,,
1271286449338380295,BressanLucia,,,162,43,49,2013-02-19 20:07:15,2020-06-12 03:41:23,0,"Comunicazione, promozione integrata, formazione e informazione, e-commerce, sistema fieristico, finanza: è attorno a queste parole chiave che ruoterà la strategia del #PattoExport.
Per sostenere le imprese italiane all'estero nella fase post Covid-19. https://t.co/ucNAe0lbFS",[],,,
1271286179745247239,benhoss69,"#WWG1WGA Bassist; In Erinnerung meine Freunde Braves Bürgerlein, Hartes Geld und alle anderen die nicht mehr dabei sein dürfen",,831,463,16775,2009-09-14 14:43:33,2020-06-12 03:40:19,890,"#Covid_19, per mettere fine alla propaganda di regime #Bolsonaro manda la polizia per controllare le sepolture,,,, e guardate cosa scoprono!!!
#ArrestateliTutti https://t.co/N6y1rHAxTl","[{'text': 'Covid_19', 'indices': [19, 28]}, {'text': 'Bolsonaro', 'indices': [73, 83]}]",,,
1271286151911837701,Tiburnoofficial,"Il settimanale della città del Nord-Est dal 1989
La nostra edicola digitale
https://t.co/Q0UeH36oin",Tivoli,91,1589,3390,2012-03-27 10:01:25,2020-06-12 03:40:12,0,"Fiano Romano – Altro positivo al COVID-19, il totale è di 8. Da poco la ASL mi ha comunicato di un'altra https://t.co/8KabKrvVmZ #tiburno","[{'text': 'tiburno', 'indices': [129, 137]}]",,,
1271285883996475393,gi_welcome,"Più lunga è la pensata, più grande è la minchiata","Apulia, Italy",609,675,23760,2009-07-08 22:18:58,2020-06-12 03:39:08,199,"Vorrei fare una domanda a chi anela al vaccino contro il Covid : ma il vaccino antinfluenzale, ha forse debellato l'influenza?",[],,,
1271285850509209600,rcarangelo,"Il primo atto d'indipendenza dell'uomo,fu peccare.🇮🇹Non faccio polemica.Blocco e stop. 82° RGT Fanteria Meccanizzata ""Torino"" Folgore"" Presente.",,1470,1514,104214,2011-08-27 16:36:14,2020-06-12 03:39:00,292,"Comunque ho parlato con un amico in Cina, ha detto che è meglio non prendere il COVID-19 perché a Settembre esce il 20... Con più funzioni.",[],,,
1271285626843750401,xilax65,,,368,165,12832,2012-03-19 19:29:51,2020-06-12 03:38:07,126,"In Germania si chiedono se il COVID fosse una vera pandemia o solo una brutta influenza derivante da uno dei tanti virus. Sono morte 250 mila persone di COVID contro  1.500.000  di influenza degli anni precedenti. Valeva la pena bloccare l'economia? 
https://t.co/a6p2Np9mM1",[],,,
1271285609915543553,marzia38580873,"2020 l’anno delle coincidenze, ma io non credo alle coincidenze.  Chi vivrà vedrà...🙏",,196,224,4607,2020-04-19 07:44:43,2020-06-12 03:38:03,126,"In Germania si chiedono se il COVID fosse una vera pandemia o solo una brutta influenza derivante da uno dei tanti virus. Sono morte 250 mila persone di COVID contro  1.500.000  di influenza degli anni precedenti. Valeva la pena bloccare l'economia? 
https://t.co/a6p2Np9mM1",[],,,
1271285537685622784,v3rd3acqua,Pace e fortuna,,1379,530,37374,2014-02-23 08:29:50,2020-06-12 03:37:46,36,"Nelle ultime due settimane è diminuito considerevolmente il numero dei tamponi effettuati dalle #Regioni per il #Covid-19. Lo segnala la Fondazione #Gimbe nel suo monitoraggio settimanale. #ANSA
https://t.co/nLasHr7PFq","[{'text': 'Regioni', 'indices': [114, 122]}, {'text': 'Covid', 'indices': [130, 136]}]",,,
1271285465342083073,ZzaPina,"Sommelier e appassionata di tè, bere è uno dei pochi piaceri della vita, come Mondello.",,3949,7061,132819,2012-10-28 13:24:24,2020-06-12 03:37:28,5,"Oggi, 11 giugno, per la prima volta Piacenza e  l’Emilia  Romagna  contano zero vittime. Il bilancio complessivo dei morti da Covid-19 resta comunque tragico nel Piacentino: 961 persone hanno perso la vita da febbraio a giugno. I casi di positività salgono a 4.519.",[],,,
1271285102983573505,zWuY4L5A8OUgyZ5,,,79,29,6678,2020-01-29 12:25:36,2020-06-12 03:36:02,890,"#Covid_19, per mettere fine alla propaganda di regime #Bolsonaro manda la polizia per controllare le sepolture,,,, e guardate cosa scoprono!!!
#ArrestateliTutti https://t.co/N6y1rHAxTl","[{'text': 'Covid_19', 'indices': [19, 28]}, {'text': 'Bolsonaro', 'indices': [73, 83]}]",,,
1271284953834311680,rhansens,,,1939,892,21676,2009-05-20 23:32:15,2020-06-12 03:35:26,890,"#Covid_19, per mettere fine alla propaganda di regime #Bolsonaro manda la polizia per controllare le sepolture,,,, e guardate cosa scoprono!!!
#ArrestateliTutti https://t.co/N6y1rHAxTl","[{'text': 'Covid_19', 'indices': [19, 28]}, {'text': 'Bolsonaro', 'indices': [73, 83]}]",,,
1271284593115557889,annamarone,Antifascista. Donna. Mamma. Tnpee. Per quanto ci crediamo assolti siamo per sempre coinvolti.,"Busca, Piemonte",2171,1087,34131,2010-05-04 19:58:40,2020-06-12 03:34:00,1613,"Leggo che in #Lombardia ieri ci sono stati 32 decessi per #Covid. Non si sa però dove, in quale provincia, perché la Regione non comunica + i dati divisi.
Da quando abbiamo segnalato che i decessi reali erano molti di + di quelli “ufficiali”, hanno secretato i dati per provincia.","[{'text': 'Lombardia', 'indices': [31, 41]}, {'text': 'Covid', 'indices': [76, 82]}]",,,
1271284462836264961,LKynes4,,,1036,311,57306,2016-01-26 23:00:37,2020-06-12 03:33:29,292,"Comunque ho parlato con un amico in Cina, ha detto che è meglio non prendere il COVID-19 perché a Settembre esce il 20... Con più funzioni.",[],,,
1271284435657224195,45acpjoe,"#2A #ArmyVet #Lazio #MΟΛΩΝΛΑΒΕ #trump2020 block @pierofassino @CZampa_official @rinfascelli @Abocconetti @makkox @albertobagnai
 FF By @RealEricCarmen @JohnCena",Skull Island,3675,3531,181660,2017-02-09 02:34:29,2020-06-12 03:33:23,12,"Mondo, giugno 2020

L'OMS ha le idee sempre più chiare sul COVID19. #fotografiesegnanti #10Giugno #COVID19 #COVID__19 #OMS #split #jamesmcavoy #propagandalive https://t.co/qXe80O6iaj","[{'text': 'fotografiesegnanti', 'indices': [82, 101]}, {'text': '10Giugno', 'indices': [102, 111]}, {'text': 'COVID19', 'indices': [112, 120]}, {'text': 'COVID__19', 'indices': [121, 131]}, {'text': 'OMS', 'indices': [132, 136]}]",,,
1271284364802846726,MuseoDeArte,"Los esperamos. Contiguo a la Basílica del Roble, en el Centro de Monterrey. Entre Guerrero y 15 de Mayo.",,386,463,662,2015-11-24 19:39:06,2020-06-12 03:33:06,2,Il Papa crea un fondo per lavoratori in difficoltà a causa del Covid-19! - Vatican News💡  https://t.co/2PnhbTa3ei,[],,,
1271284102939856898,zazoomnews,Zazoom Info ... rimani aggiornato e segui le ultime news dalle migliori fonti del web!,Italia,30,999,1089906,2016-04-04 17:22:24,2020-06-12 03:32:04,0,Zaia De Luca e Bonaccini governatori più apprezzati per gestione Covid -  #Bonaccini #governatori #apprezzati  https://t.co/ZfRCmdKegk,"[{'text': 'Bonaccini', 'indices': [74, 84]}, {'text': 'governatori', 'indices': [85, 97]}, {'text': 'apprezzati', 'indices': [98, 109]}]",,,
1271284099152404481,TelevideoRai101,,,0,50,30843,2018-04-29 17:03:52,2020-06-12 03:32:03,0,"Covid-19, in Usa 941 morti nelle 24 ore",[],,,
1271284078050897920,Chiara01037585,,,0,1,308,2019-05-13 17:09:08,2020-06-12 03:31:58,1,"Le mascherine, come i guanti, sono ""protezioni"" contro il #COVID19 . Dopo il loro utilizzo (monouso e non) non disperdetele nell'ambiente; seguite il semplice consiglio di @AliaServizi
 e conferitele nel residuo non differenziabile! https://t.co/58tdmCaxxC https://t.co/OTEyyZDuZk","[{'text': 'COVID19', 'indices': [75, 83]}]",,,
1271284038792183810,ANSITorino,"A.N.S.I. TO2-UniPegasoTorino è convenzionata con l'Università Telematica Pegaso per il conseguimento di Lauree, Master e Corsi di Alta Formazione.","Piazza Castello, 99, Torino",292,165,7261,2014-03-08 15:04:57,2020-06-12 03:31:48,0,"""Coffee Time Lectures_47"". Le riflessioni quotidiane di Andrea Quintiliani sui temi di economia e finanza aziendale ai tempi del Covid-19 (Riflessioni tratte da un lavoro monografico di prossima pubblicazione). Fonte: mio profilo Facebook. https://t.co/VdjboSK5rX",[],,,
1271283765042536448,HorecaNewsit,"Informiamo quotidianamente gli addetti ai lavori dell’HORECA con notizie, interviste, video reportage, ricerche di mercato e tanto altro sul comparto.",,1576,488,14683,2016-06-11 07:04:59,2020-06-12 03:30:43,0,"TheFork introduce una nuova funzionalità per conoscere le precauzioni anti-COVID prese dai ristoranti
https://t.co/Wqvfdp0EN7 https://t.co/5LplcqNN9D",[],,,
1271283342122586114,zx77789,If  My people shall humble themselves pray & seek My face & turn from their wicked ways then will I hear from  heaven&forgive their sin and will heal their land,,1992,1590,45351,2009-04-20 22:17:13,2020-06-12 03:29:02,890,"#Covid_19, per mettere fine alla propaganda di regime #Bolsonaro manda la polizia per controllare le sepolture,,,, e guardate cosa scoprono!!!
#ArrestateliTutti https://t.co/N6y1rHAxTl","[{'text': 'Covid_19', 'indices': [19, 28]}, {'text': 'Bolsonaro', 'indices': [73, 83]}]",,,
1271283202959630337,MimmaIaconisDe,,,69,25,409,2017-02-18 18:00:17,2020-06-12 03:28:29,1613,"Leggo che in #Lombardia ieri ci sono stati 32 decessi per #Covid. Non si sa però dove, in quale provincia, perché la Regione non comunica + i dati divisi.
Da quando abbiamo segnalato che i decessi reali erano molti di + di quelli “ufficiali”, hanno secretato i dati per provincia.","[{'text': 'Lombardia', 'indices': [31, 41]}, {'text': 'Covid', 'indices': [76, 82]}]",,,
1271283063524294656,mrbrltr,"Christian: Father, Husband, and Patriot, above all else. Constitutionalist. Retweets are not endorsements.","Wisconsin, USA",1776,1050,3423,2019-10-13 13:08:14,2020-06-12 03:27:56,890,"#Covid_19, per mettere fine alla propaganda di regime #Bolsonaro manda la polizia per controllare le sepolture,,,, e guardate cosa scoprono!!!
#ArrestateliTutti https://t.co/N6y1rHAxTl","[{'text': 'Covid_19', 'indices': [19, 28]}, {'text': 'Bolsonaro', 'indices': [73, 83]}]",,,
1271282940408823810,fabio_brenna,"un paese che all'incontrario va, finisce a gambe all'aria",Provincia Di Monza,71,43,5983,2014-07-09 08:52:00,2020-06-12 03:27:26,83,Nemmeno il sindaco della città più colpita al mondo (fonte @nytimes) riesce ad avere i dati da @RegLombardia. Come si può gestire la sorveglianza in questo modo? Poi criticano i cinesi! La TRASPARENZA è essenziale per contrastare #COVID https://t.co/zIpIzNJpwt,[],,,
1271282531875188737,RealMoniOlive,"Patriot, Wife, Mother and  Love God and Country.🇺🇸 Web Designer #AmericanPatriot #MAGA #KAG #Q #Qanon #WWG1WGA #MAGA #BuildTheWall #DrainTheSwamp",,1453,1179,4921,2018-04-06 21:04:12,2020-06-12 03:25:49,890,"#Covid_19, per mettere fine alla propaganda di regime #Bolsonaro manda la polizia per controllare le sepolture,,,, e guardate cosa scoprono!!!
#ArrestateliTutti https://t.co/N6y1rHAxTl","[{'text': 'Covid_19', 'indices': [19, 28]}, {'text': 'Bolsonaro', 'indices': [73, 83]}]",,,
1271282389604433920,piras_zia,,,381,827,218875,2013-01-27 13:53:57,2020-06-12 03:25:15,20,"VIGANÒ A TRUMP: LA GENTE SA CHE I MASS MEDIA MENTONO. PREGO PER LEI.
https://t.co/z0YStWoAnV

""Le indagini già in corso sveleranno le vere responsabilità di chi ha gestito l’emergenza Covid non solo in ambito sanitario, ma anche politico, economico e mediatico."" 
1/2 (segue)",[],,,
1271282142069186561,Axe_Maldonado,"Tech Evangelist and entrepreneur, helping companies into digital transformation",Italia,891,172,18199,2014-01-29 12:55:49,2020-06-12 03:24:16,0,Dai uno sguardo al mio ultimo articolo: How will the hotel experience shift after COVID-19? https://t.co/t1vVZysip6 via @LinkedIn,[],,,
1271281546725490688,Rosyfree74,Un gatto addomestica le persone solo quando sono pronte.,,3759,3761,124788,2011-05-25 22:20:03,2020-06-12 03:21:54,244,"Sindaco @giorgio_gori sono l'autore del pezzo uscito su @24infodata 
Confermo: dopo il nostro pezzo e dopo che @ondatait ha pubblicato i dati @RegLombardia ha chiuso l'accesso ai dati. Ho fatto richieste Foia per averli, non ha risposto.
Qui il pezzo: https://t.co/BmOiVUyzbc https://t.co/rl717RwdGb",[],,,
1271281535547617290,gfrizzuti,"head of #communication #pr #prof #giornalista. Nientologo, le opinioni espresse impegnano solo me. Views my own",,180,177,1321,2010-05-25 12:22:38,2020-06-12 03:21:52,1,"#Letteraf – 21/2020

In questo numero: 
1. UE-Balcani: Investimenti e riforme, primo vaccino anti-covid
2. @Lagarde al Parlamento #Eu
3. OCSE e reddito perduto
4. @EBA_News: banche europee con spalle forti a ingresso pandemia

https://t.co/rrkLGsHYPb https://t.co/CHTDeEpAuV","[{'text': 'Letteraf', 'indices': [11, 20]}]",,,
